id,subreddit,body
gnmhj4g,Games,fact dialogu suggest must done someth wrong along way that reject never got impress shes go like shes lead make relationship seem like anyth els lead point suggest hit earlier convers say someth effect yeah right anyth would suggest interest even go later say know im actual pretti tire talk later choos worst play like actual im drunk thought never felt video gamey enough feel like fail convers option seem pretti real bit awkward panam pretti good exampl real femal relationship game imo your friend doesnt anyth els that okay
gnjf0ka,Games,never play forgot it
gnlvazl,Games,ive think lot shadow war nemesi system sinc patent news regular discuss subreddit think want romanc game exact problem nemesi system damn expens requir much man hour whole idea procedur generat storylin bit flaw begin even shadow war actual wriiten storylin idea orc betray vengen come save come humili ambush took essenti quest idea multipli amount voic orc case shadow war buttload end result nemesi system middl worst world doesnt depth polish handcraft content doesnt cheap repeat procedur generat system driven content reason system prais yeah huge step radial quest need defend setllement sustain probabl viabl buis perspect cant boast uniqu good hand craft stuff problem feel romanc type mention go face increas quantitiy activ might reduc qualiti given budget involv varieti charact charact list possibl activ quick get control term product cost essenti n amount romanc charact n scene cafe differ dialogu made n bowl date n movi watch etc go even common potenti relationship storylin let call like nemesi system need n scene say yes n scene suspicion cheat n scene resolut n foreshadow grow apart n scene make talk person agre would awesom first hour shadow war excel reason nemesi system didnt get chanc start repeat almost feel like handcraft stuff term product write feel essenti quick fall apart basic start play exact quest exact storylin youv play like hour prior romanc game exclus deal least western rpgs chanc repeat singl playthrough small think approach could work certain amount activ rpg interest person would take hand written uniqu quest love nemesi style system see could absolut work enhanc experi player use support system top hand craft quest
gnl0eny,Games,lol oh okay second updat versus first still ode shitti redic prioriti
gnmqn3p,Games,that total fair assess thing panam say exact thing flirt male femal v interpret yeah right interpret flirt back doesnt matter thing use visual novel term trigger flag success play either sex feel like your succeed even chanc final flag fail your given indic happen say someth wrong earlier forget give item side quest secondari object miss your never given inform game honest better approach might give indic shes realli much earlier like exampl first meet there exchang rent room twin bed could modifi exchang teas play your male v like main game your femal v polit refus share bed thus give clear distinct indic earli shes pursu end disappoint well that fault basic differ interact flirt male femal v instead keep same
gnjhsvj,Games,never play ive own origin intent play dont know long think end start drop rest
gnl17z6,Games,serious suggest minor chang tran person dialogu came cost fix bug imagin game would like hypothet world biowar ignor complaint tran peopl make comic touch represent tran person
ll4dds,Games,
gnnb2a7,Games,fifti minut e hope show zelda anniversari stuff honest could anyth even last edit last proper septemb ds anniversari next week too
gnnb3qd,Games,what everyon wish list direct person hope zelda news
gnnb78v,Games,rememb everybodi realist expect develop work home covid project progress would normal anyway readi metroid prime collect f sx astral chain dragon quest xii pokemon heart diamond soul pearl reviv iwata robot bodi shrek smash
gnnb31a,Games,final full fledg direct sinc septemb accord nintendo record https www nintendo com nintendo direct archiv
gnnaw76,Games,real nintendo direct feel like fever dream
gnnbuek,Games,last general direct septemb good know nintendo done direct like want believ interest almost hour state includ game come first half year time iirc februari direct includ titl theyll releas rest year anoth meati direct come e period person hope zelda th collect smtv releas date bayonetta updat mayb new ip
gnnb78q,Games,year https kym cdn com photo imag origin afb gif saw someon specul would come soon zelda th anniversari didnt expect soon cant wait see new smash charact
gnndg70,Games,thing probabl pokemon stuff pokemon announc come up
gnnch16,Games,guess republ commando announc im almost expect battlefront come well consid ad remov updat full control support last week
gnncwan,Games,come lego star war still dont anyth concret spring almost spring
gnnblbf,Games,recent taiwan rate leak unfortun spoil im look forward herlock sholm meme thursday
gnncoxz,Games,predict wishlist zelda collect th anniversari xenoblad chronicl x port remast new yoshi game new kirbi game fire emblem remak silksong pleas
gnnene4,Games,first full direct year memori doesnt betray crazi long went without proper count indi showcas smash pokemon exclus stuff
gnndlxi,Games,put like old zelda game switch collect pls realist expect would realli get pump sinc botw play
gnndyxo,Games,would kill ss remak remast amount effort requir make happen due game root motion control doubt happen nintendo seem keen put effort remast remak late
gnnhs0x,Games,realli want zelda th anniversari stuff botw news would great sprinkl thing like metroid prime news anim cross year pipelin stuff least hint thing like gyroid cook probabl go first parti direct anyway
gnnt89x,Games,realist expect shin megami tensei monster hunter monster hunter stori hero pok mon snap first parti titl kirbi first half teas nd half mayb bayoneeta u realist botw prime new ip monolith either way gonna good stack year nintendo
gnncv09,Games,mean gotta f maker style gx right absolut noth els nintendo put point theyv final gotta dip f right couldnt possibl spend anoth year make well sega make ball wall fast f game right pleas love god nintendo let right
gnnpz9r,Games,realli hope phoenix wright get smash probabl go crash like
gnneq4g,Games,hope kotor remast announc get hope high rumor float around kotor come switch
gnncjq2,Games,get general direct almost year sinc last thought job list inevit zelda pok mon direct hope get anoth teaser trailer mp xenoblad rep smash
gnnk2lo,Games,monster hunter smash predict year rise come im pretti confid
gnndsah,Games,realli hope switch pro somepoint year tech year old new consol awhil get use k fps switch bare scrape p fps prolli happen direct mayb zelda anniversari stuff teas least
gnnhxti,Games,expect releas port game consol get new game announc ill impress doubt well see much new though hope least get updat game like botw mp beyonetta dev announc year
gnnjl7m,Games,nintendo vagu new smash bros inform come soon reddit goku kenni omega confirm spray champagn boy
gnnm8no,Games,predic nobodi read new smash charact reveal seem obvious twilight princess wind waker hd releas includ rd game think like oot rather skyward sword mario sport spinoff earli summer probabl mario golf nso onlin freebi avail today news upcom anim cross updat sequel game nobodi realli ask seem cool anyway new trailer botw come holiday longshot predict releas samus return switch see happen new metroid game pokemon diamond pearl remak switch metroid prime trilog releas news return forgotten franchis like f bayonetta news
gnnn54s,Games,final peopl twitter reddit youtub quit whine want real direct probabl keep whine dont get specif thing want it
gnndrs4,Games,silksong releas right riot friend serious need get date least time
gnnhh1u,Games,final like year sinc last proper nintendo direct min great
gnnmagl,Games,want play super mario rpg snes emul everytim tri play mean freez equip pant mallow
gnnq0nx,Games,honest even new game come excit resembl sort return normal desper need past year
gnnqh2f,Games,full predict zelda collect switch come first half year new smash fighter announc updat bayonetta develop new trailer shin megami tensei v updat silksong perhap releas date metroid updat gameplay trailer monster hunter stori wing ruin breath wild updat includ gameplay new trailer
gnnr9jy,Games,first half year direct make think th anniversari zelda collect expect fall like mario star
gnnsrwn,Games,clear elden ring trailer right right
gnnsti5,Games,zelda anniversari sunday im hope bad zelda edit switch zelda switch pro wish lol
gno0r5q,Games,fact minut long somehow first half hope worrisom guess theyll announc zelda th anniversari big blowout show merch amiibo etc buy gameplay whatev game theyv cook thatll eat time imagin wonder els get earli wiiu game think port xenoblad x soon monolith work sinc xenoblad de came last spring cant imagin major titl like botw drop sort mid tier paper mario type announc store
gno2ott,Games,still hold tetri charact strong histori nintendo game classic dont know charact would exact theyv done less
gnncx1x,Games,sit still wait new f today day
gnndptv,Games,feel like year minut that hell meati direct smash alreadi confirm im guess see bunch zelda relat stuff anniversari coupl day later
gnnn91w,Games,there way theyll detail botw metroid prime bayonetta without updat disappoint lot peopl
gnnom7q,Games,biggest hope theyll releas date smt remast news regard anyth zelda probabl longest shot id like see almost certain new trailer smt realist major dedic monster hunter pokemon snap new smash bros charact still nice new info see new game exact excit prospect
gnnimlb,Games,dant doom slayer sora chief pleas latter side halo ce pleas even never fuck happen
gnnfdx5,Games,dare say silksong
gnnhf4o,Games,guess theyll announc someth big end im expect new switch im definit expect new switch
gnnjzua,Games,delet
gnncuby,Games,much like smash bros feel theyr realli milk yeah cool keep ad new charact seem cover lack first parti releas larg third parti releas
gnnsp7o,Games,gonna announc joycon stop drift
gnnqjla,Games,realli excit predict diddi kong race motorsport competizion donkey konga master kollect super mario land golden coin godzilla movi tie movi star matthew broderick finger cross cant wait new mario kart dlc itll merced benz theme includ lewi hamilton playabl charact
gnnvlop,Games,ssb stuff know seri fan bit annoy non fan take direct go min ssb coverag min news
gnne8yc,Games,rumor switch refresh im wait get buy final
gnncxt1,Games,say stuff releas first half think well wait zelda th anniversari direct releas toward end year anyth like mario collect expect see mario galaxi releas april someth earliest think see zelda announc june juli that depend botw releas holiday come march well probabl get august oct
gnncuz6,Games,wish could get excit long nintendo direct way often nintendo show game spend minut explain control everi tini littl mechan fifti minut announc realli minut forti minut gameplay demonstr never made sens nintendo treehous content kind stuff still everi often ive learn get optimist case pull kind stuff
gnnditt,Games,nah specif mention smash bros least half go meticul explain new smash charact
gnneuct,Games,minut new pokemon snap minut smash bros new fighter cappi odyssey
gnncq4i,Games,there definit someth happen start april st could start zelda year
gnnrf54,Games,minut showcas focus new hat ssbu charact get
gnnz81n,Games,funni say e e direct short minut longest direct ever
gnndmum,Games,doubt anyth ds relat would happen would cool releas updat ds like last ds id take includ usb c charg
gnne2vz,Games,minut talk slight variat new skin smash
gnnbnih,Games,realist guess new smash charact reveal zelda news botw hd remast collect finish mario th someth hope xenoblad chronicl x port metroid trilog new mario kart new mario golf rpg mechan
gnnbfzk,Games,never hope xenoblad x
gnndq6c,Games,arent much wish predict new fire emblem announc probabl remak theyr basic consid new game seri detail anim cross mario updat next month final announc kind mario th unveil plan zelda th remast collect probabl botw summer someth metroid prime trilog new game least like prime updat bayonetta assum game isnt work zealous platinum employe hidden broom closet smash fighter one freebi obvious port indi reveal republ commando get drop mayb well final get silksong date
gnnbfmd,Games,pikmin still tabl gonna happi delux
gnnf6qi,Games,news smt iii v
gnncc3b,Games,sort breath wild news bayonetta metroid next smash charact mayb new surpris exist franchis zelda relat
gnng55x,Games,new metroid would dream like botw minor zelda anniversari stuff possibl metroid prime updat consid long sinc weve one
gnnuhbu,Games,hope switch pro announc god switch need power boost
gnnv4h8,Games,realli hope new fire emblem remak announc port xenobad x kid icarus upris like skyward sword would nice
gnnd04l,Games,catch say first half doubt get botw news anoth limit time garbag deal definit announc zelda think
gnnbxn8,Games,desper wait next instal rhythm heaven seri brought back clubhous game last year im hope anoth miracl reviv year
gnnf5p9,Games,zelda th anniversari news want tp ww hd port switch mayb littl like mario hope info next smash charact sinc mention name would love hear metroid doubt first half
gnnwjwv,Games,bayonetta unlik dant palico monster hunter doomslay smash dant like palico mayb doomslay like monster rise info rampag work elder dragon like
gnnwogr,Games,hero news
gnnzr9q,Games,dppt remak announc know wont bc theyll wait christma realeas game someon mention thousand year door remak sound realli appeal
gnndoim,Games,realist bayonetta camelot next game way overdu showcas dream golden sun switch isaac felix reveal charact smash wish includ intellig system bring new advanc war ill take tellius jugdral remak fe h engin
gnnf5ia,Games,inject skyward sword hd right vain pleas im die hear sweet word master batteri switch joycon run low
gnnezcx,Games,im pray smash bros charact leak real rayman smash would dream come true dont even play much smash want boy get represent bayonetta
gnnbzw3,Games,botw botw botw botw botw botw botw
gnnftn7,Games,your delusion dont expect follow breath wild metroid prime f gx remak metroid game switch switch pro announc virtual consol support switch everi singl nintendo platform ever except virtual boy nso subscrib get free game choic platform month mario kart ultim super mario galaxi ad super mario star free dlc pokemon snap come later today new advanc war switch fire emblem path radianc radiant dawn sacr stone remad switch ocarina time majora mask remak switch new donkey kong countri game switch new sin punish game bayonetta come later today new banjo game switch gamepass come switch skyward sword remak switch snowboard wave race magenta storm paper mario thousand year door remak kid icarus insurg sequel ki u mother remak switch brand new star fox game revamp open world space rpg game xenoblad chronicl mario luigi switch excit unicycl joy con free fix upgrad program ds titl transfer program nintendo switch final fantasi vii remak switch final fantasi xvi switch dragon quest remad switch mario rabbid kingdom battl sequel doshin giant even bigger pikmin chibi robo switch
gnnc1ad,Games,nah sherk smash video game charact root someon realist like light mcqueen
gnndlmk,Games,elden ring surpris switch announc make sens
gnnf3u6,Games,dont forget like falcon f spin yakuza team
gnneink,Games,wave race let go
gnndx5x,Games,would kill astral chain recent went back play great game
gnnkend,Games,forget switch pro reveal show switch k hz panel handl ray trace better rtx
gnnhzyh,Games,xenoblad baybeeeeee
gnnwlxg,Games,pokemon heart diamond soul pearl crazi diamond pearl jam get right
gnnfss8,Games,mean pokemon etern diamond perpetu pearl
gnnl077,Games,dont forget elden ring switch port
gnnenaf,Games,love nintendo game holi shit describ entireti r nintendo thread direct
gnneb0u,Games,shrek doesnt use sword though detriment chanc get pick puss boot hand
gnnfc93,Games,set money time diamond space pearl someth like that
gnnhhv0,Games,final someon want sequel astral chain
gnnjgge,Games,like implic metroid collect new f game like wata
gnnlrs4,Games,pffff pleas where mario kart mario golf space tour golden sun remast golden sun true chibi robo sequel kirbi warrior metroid prime metroid new star fox mother
gnnnsqw,Games,damn hope chibi robo
gnnonij,Games,pfft mother port switch riot
gnnpu0d,Games,metroid prime runda smash baybee
gnnez9d,Games,switch pro announc
gnnge7c,Games,switch pro dude
gnnkgzu,Games,forgot ocarina time remak metroid prime botw
gnnq7rn,Games,im readi third parti titl never heard want follow nebul teas sakurai weve good boy girl mayb hell tell us stori explain control setup sage tell time showcas game made myth that
gnnqaij,Games,want prime collect bad liter perfect time want sink game again
gnntc1o,Games,forget shrek smash want shrek super slam hd
gnntr2w,Games,uh your wrong f next gonna call f r sx know make pentagram everi slayer sailor moon box set call ghost uncl nintendo leak info direct
gnnu521,Games,oh realli realli realli hope news hollow knight silksong
gno1by6,Games,anyon game dev shine light wfh would still major impact im softwar develop apart first month go die peopl scrambl figur child care work webcam weve back deliveri long time despit still entir remot
gnnhymy,Games,elden ring let fuck go
gnnkz85,Games,imo metroid prime trilog port isnt farfetch
gnnep0s,Games,somebodi told me
gnnh782,Games,come dude predict ridicul theyv alreadi use heart prefix gen remak there way titl diamond pearl remak
gnnfv20,Games,shut fuck let hype
gnndsm9,Games,got excit see post feel like drought usual interest mini direct indi direct excit see fulli fledg direct final
gnnhyb5,Games,know bit absurd nintendo game announc direct format make game feel import like theyr central someth dont know enough market explain work well feel similar soni state play would love say insid xbox special know advertis theyr hobbi im realli passion that excit im realli happi format back hope stay
gnnb3ya,Games,day sinc last general direct septemb th day sinc last direct mini octob th
gnnb3mk,Games,right back check isnt nirtendo america
gnnhjlk,Games,return true normalci weve wait for
gnndtuu,Games,alway say focus game come near futur nintendo e present advertis game come end despit includ game like hero botw sequel
gnne3ka,Games,person never doubt real direct gone direct seem easi remot nintendo cultur japan busi cultur hit realli hard pandem remot work probabl rearrang lot stuff finger cross open flood gate bit nintendo content
gnnfcu6,Games,last general direct septemb good know nintendo done direct like want believ sure love nintendo direct think plan covid caus issu push stuff back mini direct last year
gnnjlmj,Games,honest im expect mani zelda announc sinc still mario anniversari im expect well start see zelda anniversari stuff announc march april
gnnlz5w,Games,might see pok mon stuff
gno1kve,Games,make think theyr alleg gonna talk game come q of
gnnvmkr,Games,hope soft releas republ commando catch enough eye ear consid full remast updat graphic control
gnnc8dp,Games,first heard could elabor
gnnoq6a,Games,honest wouldnt surpris none spoil game direct none first parti even realli excit
gnnjyt5,Games,never play fire emblem game hous absolut love would definit like more
gnnks51,Games,wasnt silksong announc direct thing need life give us silksong trailer releas date hornet mii costum smash music
gnnpxzm,Games,silksong websit past day hollow knight page still rework methink https www hollowknightsilksong com
gnnrwdf,Games,kill new kirbi airrid game game childhood gcu still play sometim
gnnrjmu,Games,go new yoshi game sure
gnnrn26,Games,wonder well see long rumor kirbi game id realli interest see could kirbi
gnnroxx,Games,think sinc made star recent mario hope isnt time releas again
gnnk61o,Games,confus comment read like time final realiz talk zelda skyward sword pokemon soul silver
gnnq5l3,Games,could easili make playabl dock kickstand mode super mario parti show absolut will big seller although smp came switch lite multiplay focus might chang thing
gnnqxhr,Games,feel like chang would want make function complet pain ass play would make differ game plus id want streamlin like ww much im go give trial potenti hero hmm oh time alreadi well shit sorri dude would realli annoy yeah ill give mcguffin gonna flood whole damn forest make collect shit yeah guess say loud sound like remark stupid idea huh yeah here thingi need next templ either guess
gnnqb3w,Games,dont think nintendo would announc kotor remast kotor port switch definit possibl full remast would come direct lfg think
gnnfetw,Games,year last full fledg direct septemb
gnnf6my,Games,well year actual septemb last
gnnh0v7,Games,alreadi shulk xenoblad rep
gnnlzqp,Games,mean guess dragon quest hero
gnnm0pd,Games,inform came suggest idea scrap done rework byleth
gnnu2fv,Games,think palico would interest pick repres monhun generic hunter
gnnenk5,Games,kid game even get breath wild run p dock dynam resolut xenoblad chronicl run piti p p dock bare hd consol here
gnnh82f,Games,god pleas id glad trade portabl actual good perform xenoblad look like blurri mess
gnnvwxo,Games,reason ive pull trigger bought regular switch rumour long time come
gnnfjwu,Games,nintendo plan releas switch pro year id expect announc around would e time summer holiday releas know
gnngq9f,Games,nintendo ever releas updat stronger version hardwar consol main line
gnnnrfe,Games,switch fine need better batteri life slight better resolut dock undock tho look great
gnnn6ad,Games,gonna lie im smash fan id buy those
gnnnlj1,Games,expect pokemon news direct th anniversari later month probabl reveal everyth come franchis year
gno0ci6,Games,think diamond pearl remak would teas pokemon direct nintendo direct would pop hard mario golf game lol
gnns8wn,Games,said tweet would exist game dlc stuff like remak pokemon kinda fall scope direct like other say gamefreak event make big announc
gnni2wh,Games,oh crap id forgotten silksong ill real disappoint dont see blame remind me
gnnmd2z,Games,last nintendo direct huge letdown get hope sky
gnns40a,Games,high doubt hear anyth e season that assum anyth show
gnnng68,Games,imagin though portabl halo ce
gnnrdl3,Games,doomslay seem like even id prefer mk sinc gonna almost year sinc doom etern came director game drop hint ancient god part without trailer releas develop dlc switch smash subreedit last year saw video mii gunner wear cacodemon hat fight ken plus peopl would absolut get hype could isabell doomslay team battl like fanart peopl draw past year
gnnk8wi,Games,like show indi showcas that im expect anyth deltarun standard direct pretti much exclus first parti major publish titl port
gnnlo9x,Games,way show new switch direct absolut chanc
gnnlmvn,Games,smash certain amount dlc expect absolut make sens get peopl watch understand frustrat hear game ive wait hear whether metroid prime trilog rumor true wait hear updat metroid prime
gnnm40b,Games,middl dlc pass cours smash trailer minut long chill out
gnne0ad,Games,make think around month sinc last theyr announc next pretti consist schedul
gnnkm90,Games,wouldnt call milk someth mani peopl genuin want would complain wasnt smash like splatoon almost year activ multiplay game need support new content develop
gnno4p3,Games,disagre wholeheart especi fact smash season pass hope complet end year
gnne6rp,Games,live servic game ofc still updat lol
gnnh4yb,Games,theyr rumor point keep wait might hear anyth sever year offici switch becom known rumor
gnnfj1c,Games,week ago said werent announc new model anytim soon guess late summer
gnno7o3,Games,say get switch hold for
gnnejxw,Games,think well wait zelda th anniversari direct releas toward end year anyth like mario collect doesnt make much sens mario anniversari direct septemb smb releas septemb legend zelda releas februari nintendo treat anyth like mario anniversari month bust
gnndl9p,Games,yeah your probabl right would strang mario galaxi came couldnt even buy base game anymor though
gnngipp,Games,say stuff releas first half put someth like descript never ever stick it
gnnf8ar,Games,first half of
gnnpe28,Games,say someth like everi time like time there big game fall outsid time frame direct botw announc said upcom game exampl said certain dont think guarante zelda show think well probabl see least titl second half year though
gnnxj2t,Games,breath wild holiday releas biggest game alway releas holiday season botw except launch switch look recent histori zelda game consol ss tp ww initi releas novemb decemb rang would shock zelda real releas next month
gnnlomu,Games,expect see mario galaxi releas april someth dont think thatll happen part galaxi requir pointer control clumsi switch implement yoshi galaxi seem pretti imposs
gnndpbn,Games,mean still case minut direct usual show game includ dive mechan stuff minut mean get even number quicker segment
gnng88a,Games,mean clear dont enough content minut show otherwis there usual lot hype dedic nintendo direct make minut less would probabl result backlash
gnni636,Games,liter longest direct ever get excit dont dont understand point minut mean higher probabl announc
gnndakw,Games,honest enjoy even fact infrequ game event alway much fun watch live ive miss someth like last year bit iwata one especi put way show puppet sketch like mayb im coast good cant help it
gnnm6ck,Games,thing keep excit check focus game alreadi avail bit think ever put direct descript worri go mani new thing there
gnnsh85,Games,segment showcas bunch titl back back thing
gnnszrq,Games,never understood smash direct much time wast pointless exposit go control
gnnt4lv,Games,man rememb coupl e ago believ whole direct show charact smash ultim talk game like bayonetta anim cross metroid etc
gnnxnzv,Games,dude would amaz show botw talk new featur like minut id rather announc game minut per game
