id,subreddit,body
gnnin4o,Games,well releas game year consol imagin there go pretti decent sale consid player base starv game
gnntiyf,Games,im usual realli harsh nintendo port polici good ad content ad onlin mode far usual tweak gameplay bit make faster reactiv best mario game opinion think nintendo hubri roof world success good thing
gnm3vb0,Games,lot peopl brand new mario game opinion best mario game took everyth great galaxi improv everi way far better odyssey opinion odyssey weird like want tri new shader everywher increas power consol
gnlbzp8,Games,glad favorit mario game ever say genuin like hope like this
gnlg0if,Games,mani switch wii us moment itd interest know sale proport number consol
gnm4vtw,Games,happi world even better odyssey look forward copi deliv day weather
gnmjkjn,Games,turn game better platform peopl actual knew
gnmlz8f,Games,cant nintendo sell fan base full price
gnm7jy2,Games,almost wii u game releas switch sell tenfold gestur wind waker twilight princess
gnmazg7,Games,new mario game
gnkxckm,Games,true fact report suggest softwar might digit actual total sale number could easili closer https www thegam com nintendo digit sale physic
gnmp0j8,Games,hope enough hint see wind waker hd twilight princess hd would gangbust switch make happen
gnma69e,Games,digit download gbs iirc well probabl sell even would have
gnmg4lk,Games,confirm bought digit copi
gnkuffg,Games,yeah number doesnt seem switch outsold wii u bit x hand port year old game big chunk mario fanbas alreadi play onto system mani game compet attent
gnmzr3e,Games,yeah amaz consid hope addit onlin multiplay mean peopl see whole point game goe pretti generic mario fare utter carnag complet brilliant
gnkyqdr,Games,constant forget wii u separ consol wii peripher
gnm9lvd,Games,dont think surpris outsel wiiu expect sell almost generat later
gnndftg,Games,anyon say headlin suppos surpris sale figur
gnm07mb,Games,delet
gnl6bj5,Games,make sens sell x much would frank pretti disappoint sale wise given well switch do
gnmb8gf,Games,fyi digit sale april june couldv driven lockdown measur around world last quarter digit sale nintendo https twitter com zhugeex status
gnlf44a,Games,least bowser furi part new content galaxi seen nintendo fuckin weird man
gnmobe1,Games,even non regret wii u owner glad see game get recognit sale deserv peopl realli want open world mario time mani peopl tri got wii u solid level design allow coop mario final made realli special thought wait tri bowser furi
gnltj2x,Games,well work game good great perform peopl actual want new system otherwis doubl failur
gnlxyb5,Games,work dont see issu
gnlbopt,Games,remov
gnmgo6b,Games,bowser furi new realli great well worth price admiss
gnnero0,Games,im complain wish port cheaper cours wish nintendo game would get bigger price drop wii u low player base compar switch give game exclus former chanc latter
gnkyj5o,Games,plus player kid blast kid pretti much instinct goe opposit direct goal object
gnlpor8,Games,play kid wife terribl lol farm live earlier level game changer farm like live make much fun without game screen
gnlir7x,Games,want get game rebuy second time hard
gnm6sd1,Games,miss tablet touch screen stuff press r use gyroscop much much wors player fun wish way turn score end manag beat realli tough level still end disappoint didnt get crown
gnld3lv,Games,wii u port made buy hdmi switcher https www amazon com gp product b vx pkq ref ppx yo dt b asin titl ie utf psc instead spend pop game alreadi standard tv xbox playstat nintendo wii u switch hdmi slot wii gamecub
gno2tqj,Games,mod wii u pretti simpl see realli do
gnmkuhw,Games,wii u use switch bought switch toward end of
gnm2buv,Games,wii u stick box never use like homebrew play mani nintendo game
gnldo22,Games,accord physic uk sale wii u would much higher percentag consol owner bought game
gnm8t56,Games,think mario kart dkc tropic freez prove year ago nintendo space fill slow period world probabl want wait odyssey year compet sale mayb switch get yoshi wooli world xcx next year two
gnlz6ak,Games,tbh rather play wiiu map quick inventori switch gamepad friggin game changer
gnmlr7t,Games,someon whose never play either would glad remast would love drop sometim summer add hype botw
gnnoh1s,Games,zelda remast could well announc tomorrow direct zelda anniversari
gnmruza,Games,port port need make futur game consol backward compat like pc
gnldhoj,Games,peopl alway make argument bought game wii u need resel full price make money forc rebuy weve got product call wii u peopl bought shouldnt hurt bottom line allow hand peopl kind backward compat play game switch least discount xbox ps nintendo use dont understand mani peopl seem thrill defend nintendo abandon backward compat
gnlhkpn,Games,alreadi would need buy all
gnmqgrm,Games,topic thread exact nintendo lol
gnlu7jf,Games,yeah saw thought hey thatd fun week ahh mayb anoth time ill snag sale next fall someth
gnl9otd,Games,world think realli worth tho agre titl like dktf other dont offer anyth substanti onlin qualiti life chang entir mode play world wii u sold along wii u buy switch year later great experi replay game play bowser furi
gnl7t2h,Games,nintendo forc buy game though although pleas everyon would good releas bowser furi standalon download titl said newcom absolut worth price
gnm0y9v,Games,yeah complet fair person pick favorit like pikmin get rid wii u would much rather play wii game wii wait wii u slowli boot switch wii mode wait xenoblad x point order get rid regret
gnmvtag,Games,edit math wrong sorri
gnmndd8,Games,gamepad cool problem never realli use gamepad like ubisoft better utilis gamepad nintendo launch see rayman nsmbu like decid gamepad without ask develop team idea gameplay involv gamepad
gnmwffr,Games,dont think problem except last
gnnklfc,Games,wholli underpow system switch margin power wii u ps seri x k machin high graphic detail raytrac switch run someth like xenoblad chronicl p dock think switch littl bit stronger ps came in
gnmmnsu,Games,could know buy hate much
gnly7h0,Games,there peopl like thread reason r game seem think price product reliant age demand
gnmmurz,Games,yeah odyssey left wish platform less scaveng hunt didnt enough actual level one super short hey moon hidden everywher
gnmvqef,Games,million wii us million switch
gnmyzfn,Games,id like see tri sell cdi zelda
gnncfi0,Games,year old mario game sold today full price
gnmasrb,Games,fyi digit sale april june couldv driven lockdown measur around world last quarter digit sale nintendo https twitter com zhugeex status
gnmknz0,Games,figur appli c pretti much whole industri although nintendo tend bit lower rest your take account origin releas digit sale
gnnffdy,Games,cant doubl wii u digit sale unless im miss someth doesnt work all
gnmw16q,Games,realli rebuy everi game bought wii u where xenoblad x port thatd cover wii u game bought
gnn99ht,Games,port ds remak ocarina majora person pipe dream feel like wind waker twilight go port anyday now
gnnhafv,Games,could make sequel game wii u owner get punish feel like bought enjoy system
gnmm1p4,Games,peopl realli look download instal size consid purchas
gnmllse,Games,confirm conjectur bought digit copi yourself
gnkxk73,Games,latter statement id say mario fan purchas wii u mayb dedic must play everi game type bet general nintendo fan like play game get wii u excit got port over
gnkz08n,Games,yea sure big chunk mario fanbas think lot peopl skip wii u mean sale prove someth keep mind everyon like mario almost everyon buy nintendo buy mario
gnlltai,Games,bought weekend play ton pretti decent size mario game fan wii u consol never got hand game new love it
gnmhhx8,Games,peopl still think wii u wii add lol
gnludku,Games,alreadi world plan get switch end get anyway lol
gnmvjde,Games,lot nintendo fan never bought wii u dude
gnmml70,Games,sure would nice see origin game make port year old game
gnn3af5,Games,that ad new content fan alreadi play origin buy new new content
gnln10u,Games,remov
gnlaivo,Games,wii u announc e trailer almost entir focus control actual consol hidden away view basic white box tv explicit shown consol like last second video went back found trailer never actual show consol direct lol rememb get lot angri retort neogaf whenev would question nintendo didnt make control consol ironi
gnm359z,Games,ton fun zombieu thought mechan extrem solid game
gnna8k0,Games,switch lot x sale wii u id say number actual underwhelm
gnm0g32,Games,well count physic sale uk almost everi game sinc covid sale digit
gnm4mqx,Games,clarifi bigger mean sold x well x well
gnlfd1j,Games,yeah wii u version sold million copi super impress consid wii sold million unit number suggest game could realist becom million seller year
gnluy3x,Games,much game new
gnm0zf2,Games,guarante galaxi come along everi mario collect eshop for
gnn93ed,Games,would love galaxi come switch blast watch son play game miss
gnmrkv3,Games,wii fail consol consid wii game got rereleas galaxi port sinc free money
gnn17ut,Games,yeah feel like big reason tack get wiiu owner spend anoth port game alreadi own
gnmkpjr,Games,way buy separ screw fan stuck them
gnmzzz6,Games,xbox guy miss everi game gamecub wii u im happi lot stuff remast paid buck game walmart hour say im happi purchas
gnmjmgq,Games,think great tbh lock best game consol port great game last gen bowser furi fair signific add nice cheaper honest think fair price
gnmf0m8,Games,problem r game tie ident certain publish kill exclus nintendo year old game outsel heavili discount bundl exclus ruffl feather
gnn1eza,Games,start issu game get remast sequel wiiu number seri mario kart id pretti frustrat right now
gnlgp3v,Games,remov
gnliofp,Games,remov
gnkznq5,Games,lol took us round kid start work togeth us son kept run end skip star hour start play togeth fun
gnlku3j,Games,year old team game realli counter oper game
gnm4alt,Games,play stardew valley minecraft year old daughter love craft creativ aspect absolut give shit think ahead collect resourc futur use hey sweetheart sell need money daddi new backpack sell proceed sell metal ingot wood stone perfect
gnlpt3v,Games,remind play new super mario bros wii neighbor elementari school age brother neighbor impati alway rush toward object without wait us safe keep brother cautious move far slowli stage averag pace found lot way accident fuck over
gnkz0rw,Games,consid militari academi
gnnc650,Games,hmm interest consid coupl stage might good mind share farm up
gnluwp4,Games,see local librari get week year might go sale for
gnldmx2,Games,shelf space would need buy extra control batteri wii u wii old charg pack shot work peopl dont space old hardwar ive got collect dust trunk probabl put shelf day someth
gnn0c9j,Games,would abund wii u port impact decis
gnm5x4k,Games,ive got nes classic snes classic that
gnlx0mv,Games,yep make sens own wiiu like diehard nintendo fan wherea switch much broader appeal core game like lower adopt rate
gnls73r,Games,bundl titl well would drive instal base up
gnmmasv,Games,great whole consol wiiu port origin game glad spent money it
gnmdm0h,Games,true vast major gamer simpli wii u conveni switch realli difficult beat like wii u suck tether consol
gnm2skb,Games,your wrong portabl ww make smile think ww might rate game ever charm
gnn5prs,Games,exact hope drop trailer botw announc collect keep us busi time be
gnlfcmq,Games,dont think stick blu ray disc switch
gnldzgd,Games,wii u nintendo doesnt sale
gnlmkvh,Games,ive support nintendo sinc kid ive everi consol theyv made realli dont get seem anti consum game digit game tie nintendo account kid arent even abl use game use account stupid see abl verifi game without backward compat sure could design someth wii u would check flag nintendo account wont put much effort it
gnn1uhz,Games,peopl bought shouldnt hurt bottom line allow hand peopl kind backward compat play game switch least discount troubl see peopl figur game system forc nintendo implement anti consum measur result peopl start buy wiiu titl today cheaper state order claim backward compat would nintendo need jack price titl wiiu close loophol seem like end wiiu owner havent gotten switch get screw
gnlvpa4,Games,call defend say entitl free stuff like everyon get peopl want pay thing want free cheap switch alreadi bought wiiu expect busi reason sell full price new platform act like soni microsoft backward compat consum friend nice lock peopl peopl ecosystem rush buy new system even game want play exclus new hardwar busi decis favor nintendo strategi peopl buy system like uniqu featur buy game great love them
gnm8kv3,Games,bought call duti xbox would make argument own discount free playstat that essenti argu own game wii u switch
gnljxi2,Games,id like play bowser furi
gnlkmyv,Games,lot reason could switch control play peopl could want play portabl bed someth cours port come extra content onlin play tempt worth
gnlwt6v,Games,ill probabl buy use
gnmgrsp,Games,ive consid im equal consid play wii u game sinc went year back
gnlmsf5,Games,great game pay updat version isnt worth imo frustrat thing theyv pop lot wii u game switch charg full retail price new super mario bros exampl noth peopl alreadi yeah know dont buy dont im frustrat
gnllpx8,Games,your absolut right arent id like play bowser furi im forc buy game alreadi play unfortun way verifi wii u game switch isnt backward compat happen wii wii u well store purchas didnt transfer wii u rebuy show consum friend soni microsoft allow backward compat free upgrad game ive learn year multipl switch consol nintendo consum friend love product game incred frustrat
gnn2131,Games,right told us mani thing never anyth felt like got molyneux d
gnn1uvm,Games,dont person standpoint ive never issu nintendo archaic name wont pretend didnt creat massiv consum confus im glad microsoft will step take heat past year touchpad favorit innov nintendo consol never half announc plan want buy second person screen told us could eventu deni system underpow hell that nintendo mo sinc polygon took sprite ever realli mind man wii u absolut weakest stack current competit yeah problem nintendo consid system failur isnt opinion piec wouldnt see fantast game librari port switch otherwis love wii u shame els did
gnm0oy8,Games,found mani peopl game communiti oblivi general public entitl like million peopl wiiu million peopl bought world million switch sold fraction million like nintendo cater price game somewher around million peopl switch never play game nintendo consid price conscious realli want buy peopl bought game think worth buck play insignific irrelev come demand portabl ad new mode onlin multiplay give peopl reason buy interest thing got news alreadi play game enjoy need buy again
gnmar7h,Games,sure dont see film industri rereleas old movi newest format discount price either nobodi forc anybodi doubl dip either want conveni improv new version dont whine isnt go chang anyth folk especi fli shelv prove peopl dont mind pricetag
gnncdp5,Games,theyd promot rare releas collector item
gnncgxo,Games,sad
gnnbprn,Games,ha imagin lockdown effect end
gnndhza,Games,uk number right uk still lockdown game shop close supermarket arent allow sell game physic sale entir onlin amazon big wouldnt surpris digit bigger market right now
gno0lq8,Games,wiiu digit sale prolli nowher close switch
gnmysam,Games,bought mani bought xcx wind waker
gnng23z,Games,took care wii u didnt turn pumpkin stroke midnight switch launch
gnn3rf5,Games,realli rebuy everi game bought wii u yes dont want miss new dungeon add wind waker hd tinker reveng twilight princess hd link shadow
gnn2n2e,Games,cant imagin scenario someon say oh wasnt go spend gb guess will
gnmm529,Games,moment gb card near enough
gnlnyc9,Games,nintendo fan put mani hour wii u limit avail playtim happi get port other enjoy happi wait potenti releas infinit less time play game year ago would never play mani great wi u game even port switch see win win grow switch librari attract player turn grow industri confid nintendo mean third parti port exclus result varieti game everyon complaint never time play all
gnkxqcb,Games,clear proportion excit would sold closer x instead x
gnmfpxi,Games,everi major nintendo consol except wii u bought everi main seri mario game near launch sinc mario launch day n wii first chanc play game excit get final
gnkyvnd,Games,doubt general nintendo fan refus spend coupl hundr dollar play nintendo game year doubt mani nintendo fan went hiatus year wii u still get game
gnl8j5t,Games,own everi nintendo system wii u yes virtual boy sorri look dumb
gnlpw4n,Games,remov
gnlobs4,Games,rememb vivid entir reason skip excit thought switch end becom news came pad alway tether base becam underwhelm
gnnb4n8,Games,remak previous gen doesnt includ onlin sale quit impress
gnmfdam,Games,agre impress still quit crazi peopl own wii u get game probabl wii u best game
gnlzism,Games,bowser furi hour extra content man great hour imho
gnlyen0,Games,cat shine new mario game way expect
gnlx8mi,Games,game come mode super mario world bowser furi super mario world game wii u bowser furi new content
gnmbq39,Games,ive hold forev realli hope happen never know nintendo
gnnasoz,Games,nintendo arent friend arent nintendo theyr never go reward fan loyalti much like theyll take advantag fan loyalti resel old game full price theyr busi aim isnt make happi aim get spend money product servic
gnnghmg,Games,think everyon well awar nintendo king exclus soni well dont think anyon thought theyd dethron nintendo
gnnnezv,Games,lol like millenni switch owner need valid
gnn8r9y,Games,wii u prevent get switch week ago essenti alreadi play mario kart botw world pikmin mario maker even smash basic engin final got odyssey pokemon anim cross though
gnlhgkh,Games,remov
gnkzszx,Games,well glad enjoy look forward someday play kid day come lol
gnm4fp1,Games,mine like delet save game work dad start cat quest us annnnnnnd hour playtim gone
gnkz9e4,Games,want understand object end brain damag
gnn5atx,Games,sound like rpg player behavior
gnnfgaz,Games,https youtu jxv og gin exact follow pretti close seem peopl use
gnldxlq,Games,yeah tri convinc anyth say definit still worth wii u plug get play time switch far surpris mean wii u pro control batteri total die famous great batteri wii remot non issu bunch recharg aa xbox wii control love
gnm67nb,Games,yea cant nativ play pikmin best thing wii u given me
gnmnoxg,Games,yeah sting bit bought wii u least switch still exclus first parti titl well much better third parti librari game
gnmgljf,Games,definit choic wiiu featur pull it
gnmadxh,Games,think wind waker underr awhil get long call hidden gem underr your good guess
gnljnis,Games,yes nintendo account use wii u switch show digit sever game exist platform
gnlkbg5,Games,that true wii u digit physic
gnlrmi7,Games,never wii u
gnlolpw,Games,last point sign nintendo id consol clear record digit purchas
gnluwqk,Games,anti consum resel game new platform kid abl play digit game switch account set switch primari system
gnm3483,Games,realli dont get seem anti consum game suppli demand relat larg demand relat littl suppli specif offer thus full price game multipl young one still pay god damn piper still get money worth
gnni4hd,Games,alreadi remov cheaper wii u version store switch port launch
gnly162,Games,act like soni microsoft backward compat consum friend nice lock consum friend nintendo strategi last time nintendo platform didnt backward compat gamecub later year gba full backward compat everi platform switch too
gnmqq8f,Games,entitl free stuff alreadi bought fuck game
gnm98rf,Games,nintendo backward compat everi platform sinc gamecub includ gba came stop defend huge compani
gnmogez,Games,mean compet consol wii u switch nintendo consol exact compar
gnlyox8,Games,mario game content wise case help realli love odyssey free roam way stronger focus platform challeng
gnm0jnh,Games,wait week month see find use copi gamestop youv got week beat bowser furi take coupl hour return full price
gnmk2gw,Games,portabl still amaz peopl keep ask would buy rebuy x game switch millionth time portabl realli big deal lot peopl
gnltbdc,Games,updat version though come separ hour addit well basic smaller stand alon game
gnn4sx4,Games,far wii u port go least egregi pikmin slight distant second definit buy other poor deal specif wii u owner like less annoy get world chang ad it
gnlnhfr,Games,love idea soni kind backward compat god compar nintendo yes ps pretti awesom let kid reason xbox could get away wouldv let forget ps isnt backward compat previous releas playstat ps ps digit releas old game amount legaci content miss long take put anyth bad nintendo ive heard almost complain anyon cant read singl post nintendo even isnt post without someon complain nso game virtual consol
gnnez5e,Games,thing though wii u power consol want u better graphic ps pc version problem year later ps xbox came nintendo thing releas consol less power consol releas year prior though understand consid form factor switch honest dont think success switch today wouldv happen unless wii u flop pretti much wii us big game switch launch titl help push system
gnmhfaj,Games,matter goodwil toward loyal custom mani compani price releas lower price doesnt mean nintendo fact histori indic nintendo alway squeez everi penni custom person im mad think theyr greedi compani dont mind peopl call it
gnmc6ub,Games,that world general
gnmke9f,Games,that true slightest og star war trilog releas dvd back usd today would usd time numer releas episod vi usd youll see similar offer back futur rocki alien comic book manga novel releas new featur alway price cheaper buy straight releas
gnnhqmy,Games,share statist show even boost digit sale nintendo probabl compani big still heavili skew toward physic mention amazon bestsel most nintendo game accessori
gnn3u1s,Games,bought world pikmin zelda remast mario kart gonna rebuy p much whole wii u librari sinc odd zelda come soon rip me
gnlw43h,Games,im glad theyr bring game other enjoy idea nintendo better mean thing turn better nintendo custom idea see float lot someth ive realli ever seen pan sinc id almost go far say everi time nintendo start well take foot right gas see declin qualiti quantiti softwar experi dip light fire ass get game fire lit far experi switch better sell yes get rd parti game qualiti port declin exclus wise thing seem gotten wors year year far
gnlp2sr,Games,still huge middl finger everyon bought wii u nintendo polici port game often done unpreced measur port everi wii u game switch bought wii u expect anoth great consol like gamecub instead got shit consol shit librari consist beta version switch game actual exclus everi nintendo consol got librari except wii u nobodi bought wii u play game wait hand year play switch long game retro top lost chanc play bowser furi forev alreadi bought game wii u nintendo demand full price play bowser furi even alreadi game wii u fuck nintendo everyon defend shit compani
gnl0kxo,Games,stat base uk physic retail sale mani buy switch game digit sinc conveni immedi weird year weve bet total x includ digit im sure number is
gnkykgc,Games,switch librari much stronger wii us peopl probabl less starv decent titl
gnlc7ed,Games,bigger x your right
gnlio6s,Games,forgot part there still pandem peopl job welfar still affect hobbi game cant even afford buy game anymor im coast prepaid year gamepass ultim free week epic game giveaway anyth backlog start kotor exampl despit fact super excit bowser furi cant afford actual buy yet
gnlolt1,Games,attach rate scale linear platform grow attach rate general decreas
gnl2unl,Games,general nintendo fan time could own ds
gnl8gah,Games,almost wii owner didnt buy wii u reason anoth
gnl0cm9,Games,id counter say think werent even awar wii u aw market didnt sell well that kind fact general nintendo fan someon like nintendo game theyr super fan see heavi hitter play id say super mario world wasnt consol sell titl group like botw odyssey might might wii u like zelda mainlin mario game wii u never realli unclear world mainlin game time mani switch play game late higher sale make sens me
gnmgd3k,Games,remark petti got vote dare judg product worth money blind support corpor accept respons appar
gnluqxz,Games,remov
gnnlejl,Games,wii u sold like shit wii u number didnt includ onlin sale
gnn3a1w,Games,ill admit time confus brand think new super mario bros wii style game bit wasnt big fan eventu get wiiu love though im sucker bought glad joy game bowser furi neat far too
gnmc3v4,Games,stream entir bowser furi run took hrs min complet bad side add game
gnmavee,Games,averag mario game hour iirc basic anoth fifth mario bad consid probabl would sold well without add on
gnm3ztf,Games,would love see port land game gold
gnn9l6z,Games,world port exact wii u version game speed increas cours onlin multiplay integr
gnlhjom,Games,remov
gnlcepx,Games,there towerfal
gnnfhs1,Games,thank you
gnlf84t,Games,bet sure wii u pro control never ton aftermarket batteri pack wii mote think would probabl buy new one batteri cover
gnmle7k,Games,yeah hear still hold onto wii u like uniqu function like pikmin let use pad dedic map
gnmcmmp,Games,ww massiv underr came tp massiv overrad came kinda normal middl year later
gnlrt9z,Games,switch complet differ cultur architectur wise make sens xbox playstat due new system basic exact updat hardwar amount work isnt compar
gnmmgre,Games,wii u game use gamepad switch equival cant dual screen function backward compat possibl
gnluo4k,Games,us back came out
gnlwr0z,Games,problem stem nintendo account could play anim cross togeth
gnnixay,Games,well suck
gnlzbrv,Games,gamecub gamecub cartridg slot switch disc drive either way current strategi understand differ soni microsoft understand peopl play game year ago feel owe game new platform
gnn5xau,Games,alreadi bought fuck game wiiu sub fill entitl children
