id,subreddit,body
ljlr1h,Games,use thread discuss whatev game youv play late old new aaa indi platform atari xbox pleas dont list game your play comment elabor thought game make easier user find game your talk put titl bold pleas make sure use spoiler tag your reveal anyth game plot signific impact anoth player experi play game matter retro recent game find instruct subreddit sidebar thread set sort comment new default obligatori advertis subreddit devot type discuss rest week pleas check r whatareyouplay r game discord server feel free join us chit chat game https discord gg zrpaxtn schedul discuss post week play https www reddit com r game searchq author aautomoder titl play restrict sr sort new monday themat monday https www reddit com r game searchq author aautomoder titl themat restrict sr sort new wednesday suggest game https www reddit com r game searchq author aautomoder titl suggest restrict sr sort new friday free talk friday https www reddit com r game searchq author aautomoder titl friday restrict sr sort new all
gnjfspf,Games,sekiro replay bloodborn final finish dark soul first time decid replay sekiro well certain least replay soul game satisfi mechan perfect parri mikiri counter feel good thing stood replay much better game first playthrough genichiro took probabl tri mani hour multipl day time beat th attempt ive come realiz much easier fromsoft game play aggress confid fight took attempt beat first second tri
gngyx5k,Games,spiritfar near done game incred cant believ wasnt includ goti discuss least indi categori easili beat hade tie ori game similar anim cross stardew valley charact replac charon ferryman hade control larg boat hous mani cute anim goal nurtur prepar cross afterlif often involv feed fulfil last wish resolv final question life death stori driven indi game quit long hour enjoy gameplay loop there quit bit content enjoy admit dont enjoy stardew valley type gameplay might stick around youv play hour youv seen near everi gameplay mechan thing get complex your given thing juggl rest game basic addit new materi slight variat rather brand new mechan person realli enjoy gameplay dont want undersel repetit wont spoil game sound intrigu recommend watch trailer dive blind truli except game dont expect find anoth game full love emot long time mass effect halfway done got hype trailer legendari edit decid download origin trilog via game pass use love seri death havent play near decad surpris well game hold today standard graphic low res art direct grandeur timeless felt emot reunit charact id forgotten like joker conrad verner add bit color world start play twenti minut pretti much forgot game releas thirteen year ago know peopl critic mass effect shooter rpg blend gameplay never felt clunki enjoy mako shoot abil fun inventori fine pretti much ignor clutter play forc wield bionic never get old conced game bad difficulti spike particular matriarch bezeria fight noveria frozen lab attempt gave decid retreat normandi game design doesnt meaning support moment like would nice unlock warp back town normandi instead walk minut empti corridor get back town ill curious see whether enemi respawn come back planet overal ive realli enjoy game masterpiec way best part though didnt pay either that game pass
gnh6ltu,Games,dragon dogma dark arisen poster child flaw gem finish clear bbi bitterblack isl dlc enjoy time lot mani flaw core gameplay compel enjoy lot combat feel good chang vocat brought complet differ play style didnt tri strider rd pick love bow dagger combat felt good respons fun execut unlock skill level vocat separ main level choos loadout either skill depend weapon plus augment augment unlock use vocat idea switch around bit collect decent loadout strider want damag augment warrior strider level littl lot fun run direct explor kill big enemi found your encourag climb hit weak spot bring despit environ look similar lot grey manag make feel distinct like game take step desert ice biom area layout learn enemi deal flaw save slot bad chang vocat time person prefer level go stori come power slowli want tri sorcer look fun wont feel right jump endgam gear kill everyth balanc spotti damag calcul simplifi damag attack minus defens basic mean chip away new enemi bare hurt small upgrad like take weapon damag make huge boost bare threshold mean time combat struggl becom breez gear chang that realli atyp genr though found bbi especi work realli well first time bass drop super enemi appear knew tough fight great pawn system good idea major issu want pawn rent player rift crystal pretti unreli post messag board someth take turn didnt bother mani pawn quit bad cant search easili want import inclin copi owner ai chang base see mani new player pick lot loot pawn acquisitor pick item even battl later owner resurrect dead pawn mean pawn becom nexus mean carri unconsci pawn instead fight back player micromanag command mean becom guardian hang around master lot instead proactiv reset chang bit theyll usual natur drift somewher dont want make hire pawn chore realis import hard filter quest easili miss alway big deal care check guid side quest main one dont seem clear label main quest progress make other imposs finish remov vendor game entir there alway new game plus id rather side quest most notic board wont know find wont know new quest due complet quest go check tedious top board seem limit activ quest case low think largest might think kill crow someth take time shoot see keep quest activ mean quest back board cant see becom avail reward might less use complet tedious back way area went bbi fun dungeon hard enemi boss shortcut back base way rng loot identifi upgrad fair high cost isnt great save scum open chest good time saver great gameplay realli requir though unless want best loot dont need win death bug reset hp full reload save wasnt nice got reveng later abus bug continu spawn post game everfal dungeon design terribl fall onto platform tri hit right room annoy complet quest end game go bbi climb control quit bad shame sinc huge part combat realli problem upright humanoid enemi your climb griffin back enemi weak point low chest curs dragon drake cant see control charact relat enemi spin lot lose grip hard know way move show crawl leg skill ultim think control camera could improv inventori manag hassl want stay light materi later heavi extra gear differ scenario pass item pawn isnt hard get tedious realli becam problem bbi materi seem get heavier though stop enjoy game fun ive long time clock near hour id probabl go guid your sort get frustrat quit min maxer worri break build get stat base level switch later wont chang veteran say irrelev compar gear endgam seem true check guid bother you
gnh7det,Games,bugsnax beat half hour ago made laugh loud game play great soundtrack uniqu mechan weird good use dualsens great stori beat twist great voic act fun distinct vibe whole game might help go expect like much glad play next singl player game ghost tsushima excit multiplay apex legend usual night game friend last night game row great night lol great get feel new king canyon might time favorit map variant start treat good r pop play lil caustic go main octan respawn alway impress battlefront ii main podcast game bit hero vs villain run best mode great game longest run shooter play outsid overwatch modern warfar fall guy backup podcast game night seem land shot shooter game need lol
gnef3uw,Games,final fantasi xiv ive heard good thing xiv year ever sinc relaunch havent given shot past week recent announc endwallk ps version prompt final give go first mmo ive play realli enjoy said pretti much treat singl player rpg moment sinc friend play game heard complaint begin slow definit agre someon new genr appreci game take time spell thing pretti clear teach play job pick gladiat job sinc upgrad paladin tank pretti enjoy curious tri class especi discipl magic taken get use tank think im final get comfort abil unlock peopl queu dungeon nice understand say im new game first start play pick almost everi sidequest could around uldah start citi gradual stop stick main stori quest current level believ near end arr quest line patch stori most interest far fetch quest get rather extrem section look compani hero heard stori get better expans excit keep progress
gndyw1q,Games,valheim leftov money giftcard christma realli couldnt figur use decid check look hub bub game im hour kill first boss get ass blast skeleton black forest relat small amount time game see game doesnt anyth particular amaz aspect togeth realli creat someth special thing game say amaz atmospher travers world set calm music track absolut sublim storm roll music drop let hear wind thunder realli add atmospher game color palett god ray sunset realli set incred mood janki depth field effect creat beauti frame havent realli invest atmospher game world sinc witcher stalker shadow chernobyl gripe game water level world seem stuck sea level least ive seen get occasion ft creek puddl neck spawn near inland would nice see waterway form mountain head meadow unless cours world im play outlier thing exist
gnf3jra,Games,final finish assassin creed valhalla probabl weakest trilog think stuff better other think set lot work realli nice world roam around look great seri x took lot screenshot especi beauti light said game damn long could easili cut sever shire arc would complain pay near end neat thought present bit jumbl end fall flat kind get ish differ end none end feel satisfi certain culmin cohes whole think game trilog tie stori bit neater guess game still quit buggi clear rush hit launch new consol hey sold like gangbust work kind hope end new trilog said still play black flag rogu uniti syndic probabl abl get time next ac game come doubt see year announc new jame bond game recent play hitman want see earlier titl miss hitman absolut probabl game interest see malign fan still enjoy thought next week fire wii u first time almost year final play super mario world kind game ador land ds alway prefer mario design approach super mario galaxi goat world sm w blast play still look realli good get older cynic realli get hanker mario game twice year glad game connect shame switch though classic nintendo meant play radiant historia end use time stuff next week
gnh6xo5,Games,control realli like control lot gameplay varieti power especi launch satisfi use game look pretti ray trace enabl excel destruct physic control look play realli well oldest hous lot unsettl atmospher file good sourc world build well main campaign stori bit meh sort much mean like good world build atmospher play control gta age realli well dont like gta stori way silli charact dont take serious way littl consequ player action gta avoid problem everi move niko made mean someth end clear charact arc graphic age surpris well game stori favor charact work excel atmospher like set miser liberti citi instead sunshin state san andrea essenti piec game
gnexkka,Games,ive play control game lot awesom stuff go absolut love power levit throw chunk cement enemi feel awesom great peopl like whose aim terribl atmospher fantast creepi horror enough keep toe scare enough keep engag turn scare easili stori quit confus first lore surroud pretti awesom game dont mind read document lot frank dont mani negat thing say except man run like shit og ps never complain lag fps drop never notic even see game battl get caothic cant see shit game freez freez everytim open close menu well game good enough keep play less engag itd annoy enough drop map quit confus tutori begin werent best sometim enemi hide well problem time mission small asid alan wake dlc vagu rememb name alan wake game kid turn actual got noth alan wake think alon dark googl found anoth franchis guess neat fan know noth say littl lore heavi tast ton document charact interest first goe littl long still like dozen document dont feel like read gameplay awesom though boss new zone fantast difficulti crank took tri final boss thrill wish ps play game much backtrack mani sidequest pick know lot peopl like thing prefer linear game littl els fact im even play testament much fun thought id get bore fast like game sidetrack main stori buuut smoother experi would made even better
gni6s75,Games,still play knight old republ got manaan despit small static hub planet feel aliv never feel place design player charact insert instead dialogu quest local imbu sens perman whatev happen happen arriv continu leav though charact often catalyst polit chang planet ever feel like help win battl war except comparison someth like skyrim exampl love record town seem exist go get quest buy item sleep inn rememb rare realli feel issu go skyrim present yes npc routin servic exact kotor npc routin imagin life citizen dantooin remain frustrat jedi shield rest world problem struggl sand peopl distrust worlder land tatooin never ceas idk man write realli fuck good well thought histori behind everi aspect planet societi make go everi side quest someth almost never hype still whole game go one
gnice3f,Games,never got digimon kid alway prefer pokemon due biolog aspect someth monster digit mechan part wasnt jam never realli got digimon evolut kind get theyr flexibl evolut path suppos kind result nurtur oppos natur outsid factor play roll mani digimon evolv thing didnt themat fit earlier evolut bug ive look monster rais game outsid pokemon megaten heard good thing digimon cyber sleuth game pick month ago final got around play initi feel mix find like world digimon design far anticip understand digimon world altern univers happen cross technolog im concept said first game problem first newcom process evolut de evolut non uniform level cap stat impact evolut multipl path complet overwhelm game basic noth eas new player system far complic monster collect rais game game isnt tough dont understand negat take time learn game becom trivial difficulti wise hour hisyaryumon shot boss encount fodder digimon basic evolv around tri find cool monster frustrat stat like abi cam forc un progress note realli dont like concept de evolut basic buff increas specif stat need later evolut feel like anti progress cool digimon like want see next stage game basic make roll back shittier form digimon pokemon despit first anim power friendship bond digimon theme game feel like dont want attach monster anoth problem game bizarr anti player friend thing miss dialogu your screw everi jrpg think ive ever play npc give progress info either game note somewher talk repeat import inform digimon cyber sleuth your listen npcs basic tell fuck convers instead repeat generic non inform line kind bizarr honest cant think game ive ever play later mayb snes era perman miss import inform accident mash dialogu box big gripe asid still love world ton love gone digimon mani uniqu anim blow everi game type water im still get excit everi time see digimon silhouett havent unlock becom avail critic person pet peev want keep separ your go make main charact person less player insert give option respond interest way tailor anim respons first game havent gotten hacker memori play charact doesnt realli speak give dialogu option give dialogu option bland situat basic ask question case anim kind happi go lucki friend boy dont let self insert everyth make charact look like marti stu realli feel like made real charact come bore protagonist rather self insert player charact world tldr bad game big problem over complex mechan poor explain anti fun realli weird qualiti life problem ive seen year bad protagonist good interest world lot love gone monster anim monster collect rais alway fun
gnhrict,Games,final finish last us part im mix feel love stori attent detail charact environ reason alon believ game talk year come biggest hangup length game think long game realli didnt much shake gameplay definit fun got way repetit didnt want see stori probabl wouldnt finish anyway game dope certain play next instal im sure ill revisit game like predecessor
gngore0,Games,rdr offici finish includ epilogu ive said mani post game special stori world gameplay etc stellar sad finish definit revisit x b undertal first time ever play tobi fox smash hit live hype nonstop silli throughout love battl system heart squar love alphi love san papyrus joy littl game flowey end trippi af x b tlou finish trade card artifact journal entri collect probabl go ng clean fulli upgrad gun stat trophi plat love game
gnm6n2y,Games,demon soul remak reach final boss demon soul remak far absolut amaz expect visual sound gameplay absolut amaz cours find much easier relax other play rest soulsborn sekiro critic lack shortcut mani boss run get tedious wors boss adjud tower knight fool idol long run old hero worst bunch imo overal whether soulsborn player ps must arguabl best seri get one difficult ramp area boss
gndw6kp,Games,got back dead cell long sinc play miss dlcs there lot new chang stuff tri min rememb stop play nowher done bc forg upgrad bump bc that fun stop thought smoothen difficulti curv fair recent updat nope still vertic line cant even reach damn forg feel im progress throw cell item ill probabl regret pool spartan sandal dont complet wast die cant even imagin bc im assum turn hit run found amus tri point balanc op turret build pet basic mobil turret im run around owl mushroom boi latter feel borderlin requir free knockback interrupt
gnfpu2g,Games,still dark soul remast think ive seen almost everyth without beat artoria dude behav like hes ds boss im readi think saniti sake abandon fight go gwyn took peek gwyndolin sinc appear favourit dark soul boss fight dont want kill boss paint world dont like attack non hostil npcs gwyndolin angri though good playthrough stat equal build level stat end lot fun way expect go back replay ds ds ill use build too
gnfz3zb,Games,final start final fantasi game final fantasi leav lot excit lot concern what come excit love begin game side charact realli fun girl squall meet begin young girl begin kingdom heart part like combat cours music great ive heard friend center game romanc sound pretti interest plus charact model look solid remast concern im feel squall immedi doesnt anyth grasp onto took long time make like rpg protagonist hope windup anim littl slow junction system littl hard grasp though sorta got end especi didnt get whole gunblad tutori get im hope arent shit ton tutori continu overal excit see what come hope concern go away start rage dumb game play dont want think pretti fun like combat littl laggi menus find desert most bore still pretti fun like car need get back ys madden straight goofi
gngk32w,Games,valheim realli good play solo hour beat rd boss find th boss locat that next goal realli sign earli access miss qol featur balanc neither bad bug ive run havent big enough even rememb sens progress pretti satisfi new biom bring new stronger challeng dont strict simplifi previous area e tier silver still feel challeng tier enemi time still tackl prepar finess tier area unlock new featur like stone build cauldron potion etc grind fight next boss hunger system least favorit part surviv game near strict eat increas max health stamina isnt requir realli outsid combat there quit bit varieti forag farm fish cook least favorit part mine tedious either recip cost need lower mine speed increas mine iron sourc requir progress respect dungeon take like hit get pool split item silver copper take forev combat good long your level ground mele enemi height pretti much imposs though bow combat decent use exclus fight boss enemi varieti fair there new speci per biom anoth varieti per type visual amaz post effect realli tie art style super color base rather detail orient weather fog rain snow keep interest build pretti well flesh need qol adjust resourc gather aesthet high list dont know well scale there lot varieti wood stone terrain manag decor noth stand mani good system make great game get better time
gngsood,Games,final fantasi x decid dive final fantasi seri realli enjoy ff remak last year play ffxv ok play ffx see recommend better easier get game seri far im enjoy xv prefer linear style similar ff r keep focus stori tell battl gameplay fun im enjoy im slowli use tactic learn move team base combat stori charact fun keep interest noth mind blow enjoy present tell aim younger audienc bad way great game chill ive bought hd remast depend feel end give x go dark soul fourth game bloodborn sekiro dark soul remast order im love far gameplay faster ds find enjoy retain deeper level upgrad system without quirk world design linear level still excel par origin bloodborn im current cathedr deep realli impress super fun explor still challeng im enjoy process discov enemi lore etc far littl less memor game possibl im overfamiliar possibl everyth bit smoother simpler outsid combat challeng that ok game im play slowli usual weekend im enjoy slowli work it
gnh4pwo,Games,anno alway enjoy build town stuff rts game consol spoilt choic plus alway clunki tough play pick anno sale standard edit manag add anoth ubi point night instal said load see like lost hour time flash hook much learn meatiest depth rts game ever play feel way head slowli learn yakuza seen lot talk float around twitter stuff yakuza hype recent ad gamespass hear urg play someth like shenmu start play realli enjoy stori tight combat felt satisfi clear go plenti stuff term mini game decid shelv invest time got mani game want play want rush yakuza go back taken good bite backlog first
gnjctmb,Games,medium play littl like twist gameplay wasnt expect wont spoil guess set main antagonist seen peopl question game pull punch regard child abus recent play shock dismiss suicid rachel foster im will give pass kind interest horror least ghost game back confront real actual horror skirt around satisfactori ive play around train realli bit buggi frustrat mess sometim join track junction arent recogn switch appear train cant pass least direct annoy see train stuck cant reach next station even though clear see track usual end delet rebuild section track work hope dont modifi later quit hard time rout train final decid start build roundabout unnecessarili fidd arrang station station manifold https aphyr com post satisfactori way build eventu came realiz tri branch middl manifold alway gonna caus kind problem scrape instead put roundabout end manifold thing work lot better mayb dozen station least main base rest differ outpost troubl ive spent much time mess around train ive even hook output freight platform main base actual anyth im collect stuff sake ive got plan build new comput factori use altern recip scrap previous ad hoc assembl id kinda plop order build stuff need build train first place week order support train network got first fuel generat run produc power monster train play ton complet success run everi clan combo coven level gotten littl frustrat combin dont synerg well forza horizon im play lot less recent actual miss entir season first time month might skip entir week jump quick play saturday night
gnje58w,Games,last week post finish doom hyrul warrior age calam postgam doom etern horizon dawn deck pc mario world switch finish doom start etern peopl right differ game part like part like less thus far feel par im mission cant rememb play bit far love environ stori way like gameplay loop quit much dont like seem overreli glori kill chainsaw weav combat wherea felt most option part seem difficulti kick ton either feel way due differ gameplay loop strang care length level feel littl long given difficulti doom level seem minut averag took littl longer realli short im pretti sure shortest level etern far took hour take almost littl long sit sometim harder sit session alway dont straight hour sit play know autosav checkpoint level like finish entir level similar dont stop read book mid chapter start mario world play co op finish main stori start solo play world im sure feel slight increas gameplay speed make area feel way harder make straightforward level much quicker im shock much rememb item locat consid hadnt play origin sinc probabl havent start bowser furi look forward much game happen moment slow weekend next week probabl littl slow game front
gndwhcf,Games,control deepli love gameplay experi levit throw object shoot felt solid cant stop listen take control https www youtub com watchv k qshkh mi song game complaint map frustrat unclear abl rotat gun without paus game interfer flow
gni7xs3,Games,control finish main stori foundat dlc ps good time combat fun least differ gun form get stronger progress mod enemi bit spongey like end feel repetit combat evolv wish uniqu enemi boss fight still pretti fun launch object enemi though build sprawl dungeon memor area like nsc power plant ashtray maze hotel plenti unus space run ton asset reus lot area look ident explor general unreward typic find document collect read copi mod alreadi labyrinth explor hope odditi hidden mission content discov secret nook cranni find noth interest found light quit bad room either super bright dark bright slider solv time boss fight foundat dlc particular screen tint red horribl still overal enjoy combat fun enough stori lore great voic act keep interest go
gnebdsl,Games,nioh hour im begin fourth region mean im rough halfway main campaign dont count dlcs still consist great nioh core combat alreadi great first game expect im surpris qualiti boss mission almost well made fun far main downsid despit area design better overal almost everi mission take place war torn castl kind nioh issu much preval almost total lack anyth scorch ruin kind depress especi dev clear make beauti area want dont nioh kind creepi curs templ noxious mine sure sometim suck least varieti goddamn tatarimokk bright side owli boss suck realli suck hell team ninja whoever thought excess color correct good challeng
