id,subreddit,body
gngeo10,Games,legend zelda breath wild come year determin final complet legend zelda game first time life play last week think question whether abl finish year quit overwhelm much game love thus far
gngqb5p,Games,tabletop simul im part week campaign resid evil board game week manag beat fail surpris us manag made start call quit took littl set term fail hous rule unlimit continu full restor stage normal campaign rule involv continu use reset fail stage full restor everyon stage campaign team consist ada friend leon hunk kendo although kendo player origin marvin knock follow altern rule player kod end stage either reviv swap charact leon ada start togeth seem well kendo hunk end swarm earli theyv handl far often joke start stage duo plot b plot think hunk kendo definit gonna plot time around ha ha minecraft start play streamer friend set server last week play initi stream friday last week see progress server follow friday stream actual want jump back start project spent time last week explor cave much weekend spent build underwat base someth want long time ive done quit lot alreadi major thing need add glass roof sourc glowston make block brighten area bit
gngogu6,Games,bought tri star war jedi fallen order sale figur heck well sort like realli grab actual never play star war game even though love stuff general battlefront queue well im play pc general love swordplay game time depend find frustrat ive enjoy lot time base sword game feel wonki other suggest use control absolut suck control play cant get hang kb im decid give cyberpunk anoth chanc anoth gamer last week thread gave solid advic turn start grow im start get hang world gameplay mechan still cannot believ took year make thing ton realli realli rough edg known better deal freakin year develop abomin complic game mani way dread inventori manag like dread hellgat london let see rememb ive decid im go treat cp like anoth borderland game expect much hype friend cdpr engag past year massiv disservic there way game game matter could live insan inflat expect set game get bit deus ex vibe later game im find enjoy gunplay cutscen take find annoy im probabl hour keep go ive general wander around random stuff im like much much tri let game tell self hatr pre buy cp fade thank
gndudl8,Games,keep play yakuza almost marathon start month ago im yakuza finish saejima long fun first time sinc start felt drag bit play bit death strand still good cant wait persona striker
gnewnzl,Games,black mesa seem good like updat graphic mechan latter mechan especi appreci consid often youd plummet origin game voic act seem bad honest npc model look like postal bad everyon realli long arm theyr bulki bare fit lab coat dont know big deal make chuckl everi often enemi hand seem much better handl like vortigaunt refer command keen way attack anim actual look pretti good know dont know els realli say half life prettier there improv thing seem miss bunch music queue origin miss put hev suit neat littl thing origin like scientist cpr guard continu origin succeed guard wake secur guard ai unintent hilari honest feel like commentari american polic offic second enemi sight theyll lose shit shoot like psychopath gun friend might near without second hesit disco elysium heard noth good game love art style although seem like type game that bit long day way prepar funni game turn ive play hour think ive laugh game ive laugh game play last year combin way lose game um inspir wont spoil happen suffic say reach game talk littl friend girl noth violent happen way heard peopl talk alway compar old pc rpgs guess look art style expect bleak depress seem yeah laugh riot time ive music whirl rag https www youtub com watchv sgkvm mw stuck head guess there someth music well would definit recommend play far your stori rich game
gndutqu,Games,far cri assassin creed fps play first month ago enjoy despit mediocr game tri play releas ran like ass prompt forgot year later sequel appar biggest game franchis idk miss start play sure like slow method anoth open world collecthaton sure sudden town errand boy got explicit kill guy liter show begin game seem like afterthought creat justifict eleventh hour far impress look good absolut motiv anyth destini beyond light season chosen good fun new activ great new strike realli excit music stil earli season though much still known new mechan level return dark engram look bright holi hell last wish hard nail
gnfdw8e,Games,hitman start even though play previous didnt retain even bit plot im pretti lost tri catch word salad doesnt give enough chanc catch whos good whos bad need know shit go kill peopl bonework boy game janki steam review dont make note fact mean great vr experi ive sever session janki made finish puzzl infuri rage quit keep come back though like minut session small dose
gnh28y8,Games,magi demo version wizard duel game cpu player seem interest year ago revisit think feel like might good seem potenti deadlock especi player setup shield heal need seri attack shield part issu might see formula done slight better game even theyr turn base physic card game even mtg speak good reason review gamemak gamemak studio licens program isnt instal right almost like tri download updat wasnt includ instal otherwis standard progress ultima vii wind waker paper mario thousand year door most catchup tropico noth special mention game base progress made
gnmfzcx,Games,radiant historia perfect chronolog game ton fun stori quit engag lot polit drama like impact time travel battl system great quit confus first probabl number reason kept put battl seem go smooth except optim usag chang im assum better player buff defens chang charact chang multipl time get move turn that specul love hit enemi overworld run past lot game enemi overworld hit determin whether normal battl preemptiv strike play lot jrpgs low level run away fashion long doesnt feel tedious boss encount godsend issu gold seem fair hard come incom come hidden chest got chapter standard histori hard put high recommend game jrpg fan
gnmsscq,Games,tekken snap copi half im never go take time learn frame data onlin isnt fun high level player low rank fun game watch shitti game learn much learn feel reliev final fantasi fun awhil reason gameplay work ive go along stori interest everyon say isnt realli isnt make heavensword peopl say get better enjoy need get mount walk take forev reason sprint cooldown
gnni8ox,Games,gave r game isnt fun everi map take way long learn mani cheater viewership terribl
gnhf622,Games,week play tri god war play ps upgrad dont general play game second time masterpiec thorough enjoy second playthrough especi fps flawless game stori act fantast top game time yakuza never play yakuza game admit realli over japanes style game normal thought look good graphic combat decent much talk overal slow delet hour half call sea look beauti bit slow could good quiet weekend unfortun least seri x sort horribl micro stutter couldnt stand look delet min tri hear get fix medium ive put around hour seri x fps fine type game overal game isnt realli captur stori ok overal littl slow far biggest critic dont feel like split screen actual add anyth game anyth detract would much prefer switch world fli full screen would probabl better perform resolut ill give anoth go sure ill get game toni hawk pro skater final bought remast game pizza night mrs use play lot back day nostalg still play great redon graphic along fps feel great lot fun control next gen version ps play hour play fps mode rt isnt worth fps honest dont get hype game fine dont think anyth over special far combat decent noth amaz stori seem convolut sake environ nice samey point im alreadi get bore remind lot quantum break didnt think anyth special didnt finish realli dont think ill end finish ok far
gni4gwj,Games,honest sinc cyberpunk came ive complet unabl enjoy game like facad broke video game arent cool anymor theyr magic anymor theyr comput program sometim dont work right way microsoft word random fuck bullet point list thing grab borderland play krieg ive play mani time ive play pokemon rubi remind childhood
gnec2yu,Games,instant farmer https store steampow com app simpl tile switch puzzler level goal water everi tile grow plant background watch littl farm get bigger bigger level increas size well control click tile click anoth switch timer move limit separ volum set window mode fix size x window reason set arent avail main menu play that check level your well water doesnt affect tile diagon spread adjac tile hold water power sprinkler take care tile around simpl easi game done well sold low price worth check music fit realli repetit though sarawak https store steampow com app short text adventur interact fiction got puzzl lover steam group curat full review charact limit reason get patch bit imag actual puzzl none go north take key open door kinda old school might even interact imag move thing along wont take much hour noth unmiss get cheap enough might worth shot your sort thing eur way much though glass masquerad lunar year puzzl https store steampow com app singl new puzzl came free play immedi khimera puzzl island https store steampow com app new mosaic came best nonogram complet someth ate alien https store steampow com app final finish steamworld dig like dev fix last coupl week stop crash time annoy progress save teleport back ship pretti much issu still crash final area rest went smooth though final boss fight bit annoy high recommend stuff last week https www reddit com r game comment lejpg week rgame discuss gmft bt
gnnh3tf,Games,spider man mile moral got ps k monitor day ago im still state awe game genuin stop everi minut stare screen detail vibranc nyc game absolut unbeliev game here
gnllq8y,Games,velhieim hell everyon game got get unsteadi unplay fps pc w ti gig ram get ea everyon circl jerk basic complet experi aaa studio come game good like game bare function turn set far could go got fps drop open craft menu go reddit find fix peopl xx xx card rave game tell peopl decent older pcs upgrad
gnf43ak,Games,cybershadow yacht club game big let feel unfinish bore artstyl weak sound music game play doesnt feel finish either dont recommend hehe
gnnhml9,Games,finish god war night ive gone seen everyth see game pretti mix feel whole thing like god war simpl task get repeat derail lead long detour energi still game look sound incred love design various environ voic jormungandr awesom truest sens word explor nors mytholog know realli popular day game seem dig deeper minuta piec media way relationship krato atreus chang time nice that clear focal point stori thought pretti well done tell krato want best atreus doesnt quit know express certain point clear krato need tell atreus past life deepli regret side charact great brok sindri hilari complet differ reason mimir offer type comic relief your actual varieti runic abil enchant equip good let player choos want play focus wave clear runic abil start click quit bit fun combat didnt like open world ish gameplay said previous post dont realli mind game seri decid shake formula open world format im still faith assassinss creed fan love breath wild dont like game sabotag format repeat break flow charact travers lock abil explor behind stori mission boss fight uniqu boss fight none realli stand opinion valkyri offer satisfi challeng even similar anoth minor variat final boss fight didnt even feel like boss fight like cinemat sequenc bunch qtes clunki movement fulli realiz cinemat natur krato movement combin need precis charact camera placement interact barrier make get around frustrat need camera favor player help aspect absenc thor odin charact speak length dont make singl appear stori lack stake take ash highest peak realm nice sentiment there urgenc requir isnt necessarili problem your given open world play game forc complet stori mission point felt urgenc anyth atreus sick couldnt care less main stori combat feel needless complex especi respect stanc grant play normal difficulti level mayb didnt need extra command unlock skill tree ultim dont think live hype game got shower goti honor dont even think best game self reflect journey top mountain year
gnl77j1,Games,love take alway felt like differ start end fromsoft game wasnt got good somehow manag design difficulti curv line player confid boss alway move differ approach them
gnng50g,Games,glad hear hold mechan art direct never play first time remast edit ps
gnhesbe,Games,podcast listen anyth game relat adjac
gnj1h8l,Games,suggest podcast game play moment use fall guy gta onlin race listen music need suggest natur listen play
gnh1x91,Games,yeah dont tri sidequest write stori good even interest mechan most come later best stori usual quest chain pictur accept pop arr quest most bad good find later complet sake went back alt click bad one fast
gnfnq4n,Games,best part arr end dont mean itll final end arr great culmin mani hour buildup heavensward keep momentum go id say next hour enjoy part ffxiv your good time
gne1dno,Games,what like solo see player roam around thing
gnh2e1d,Games,hitman absolut actual good game right play hitman game sinc first think reason fan hate absolut wasnt hitman game term stori gameplay treat game separ fun funnili enough older side grew snes mario maker world much fun older get want play mario game
gni3a22,Games,start replay gta iv episod make sure visit lost damn ballad gay toni amaz dlcs play niko stori
gni97f6,Games,definit agre gta iv favorit gta list behind sa recent replay sa last month think iv spot plan play soon get achiev finish stori hrs im hope doesnt mean rush much
gnh9qmn,Games,agre map control sometim im tri find someth check map close map immedi reopen didnt retain inform first time check shame run poor og ps game realli look phenomen consist fps
gni8yd5,Games,agre felt like went bit long end found gameplay bit repetit chang difficulti set make harder find ammo suppli combat becam much excit ration ammo couldnt heal everi encount shame mar controversi surround stori still day peopl say garbag game understand peopl like stori direct say game garbag make sens me
gnhye1f,Games,felt way gameplay would probabl agre thorough enjoy combat lot first thought perfect length want cut frame environ understand come said alien isol week ago breakdown lol
gngxauc,Games,masterpiec right havent alreadi make sure play undertal sometim get true pacifist end lot juici stuff see still
gnmo5n7,Games,adjud roll right corner rampart bowmen begin found ring bottom walk edg youv arriv otherwis wholeheart agre run boss put nevertheless love game
gngk208,Games,tri discipl never play tactic rpg want tri specif game wonder art music encourag new discipl liber announc great far like kind person made wrapper let chang resolut scale
gngyz15,Games,take advantag draw system take time make sure charact spell equip make sure set gfs learn junction stat junction magic best way boost stat
gnjha3g,Games,advic comment gave kind bad draw grindi effect option want someon time though bossfight gf drawn refin abil get magic less grindi draw get higher tier stuff lot faster import note ff mainlin ff level scale monster level like parti parti level monster level rate thing tend gain stat levelup parti give higher level magic draw still area dont level scale youll probabl notic come them
gngmji1,Games,hour coop friend find merchant found tini swamp small doesnt boss tomb sail differ land mass alreadi think game forc merchant onto starter island make swamp common gotten bore abl progress cant find biom need next tier progress love almost everyth els tho
gni1h4a,Games,ugh xv bore stop hour squar seem focus push style connect
gnhxwcw,Games,warn x garbag compar x xii hand
gnhw3hb,Games,anno control support
gnl53cf,Games,doom etern exhaust play good way realli turn time think level far long say stop whenev want nicer stop level stuff like exultia could easili singl level need put us back earth whole section glori kill chainsaw usag feel danger time think enemi far aggress could either whenev want etern ill often take hit get im care hit lot health think cultist base combat click felt realli far rd level take break wasnt like much came back coupl day work finish game soon fan bfg crucibl triviliais big enemi cours opt feel like cheat game power fantasi feel like win button apart like lot
gnhbtlq,Games,owl felt like bullshit great game inde
gngzizx,Games,fallout made attempt mod last fall ran wall hand great mod come time nexus love commonwealth reclam project turn world overgrown forest instead desol wasteland look great run smooth break precombin enjoy sim settlement far fallui relat mod global stash huge qualiti life upgrad anyth skk pretti great fan better locat damag
gngwis8,Games,stealth build silenc pistol get railroad faction get tux glass instant bond
gnivqog,Games,play seen play hour hour seem engross civ game observ like factorio tower defens tech tree
gnlkljx,Games,halo favorit game time glad enjoy it
gnl43bz,Games,im play monster boy someon said steam sale thread love ill save thought next week im last area hk lot fun someon enjoy wonder boy year ago great callback transform note type doesnt like game get lost most straightforward map marker limit backtrack area move come back loot miss
gnn1yao,Games,give hollow knight see polish get appeal felt like constant die absolut bullshit reason combat weird time freez frame break flow level art gorgeous make platform sometim hard distinguish background pair general vertic ever present danger drop screen acid pit that never end sourc frustrat top game make effort punish great everi death drop resourc long way back littl room trial error context ive made c side celest absolut love metroidvania enjoy everi second ori game even mind got lost love hollow knight paper gave tri month cooldown think im hour ultim decid drop that rare still think probabl wonder game mani get minor stanc
gnnc499,Games,gave hollow knight time similar reason tell kept come back guess someth intrigu normal come back start whole new game scratch would suck reason though fourth time came back pick left favorit metroidvania time mayb favorit say tri time game realli click say realli glad kept come back eventu reward worth game think often especi lore
gnk8u4q,Games,hade good stori rogu element design around stori way make sens uniqu
gnfyqwd,Games,gonna hate hear sure piss wow immedi drop crowd payoff complet rout c e nier automata excel would feel compel complet base fact alreadi play game tbh watch cutscen youtub caus v good
gni8j50,Games,hear say mix tenchu ninja gaiden make realli excit final play soon ive heard main parri counter rather dodg attack correct
gnjnaab,Games,iron compar sekiro tenchu sinc fromsoftwar creat franchis
gnmyfag,Games,genichiro apex game boss mechan final click peopl
gngfc17,Games,brave order definit crack combat system half term abl bust stuff give multipl charact acceler order balanc fact rare charact togeth parti look forward see go combat cs hajimari though hope figur way handl grow cast doesnt involv bring momentum screech halt everi dungeon reconfigur quartz charact temporarili rotat in
gnjl2iu,Games,gunplay definit low point prey mani high point build option crazi trophi beat game human upgrad typhon alien upgrad playstyl wild differ anoth level design top notch space station general feel well laid thought game perhap best environment storytel game ive ever play despit meet hand live human get good idea live everi singl soul station live quarter free time spent job everi singl room function purpos still interact end hour game delight intens without spoil much high urg see stori end
gngeb5x,Games,interest stuff rent local librari never realli got play rent lot tougher realli regret give game chanc braid sentinel game thought play recent think gonna start ai somnium file next narrat game first regret play braid wait remast releas see ps think thing whether want play cough money play k
gnh3yr3,Games,definit truli front burner year
gngtsmq,Games,fallen order id recommend mix style play forc dodg parri rather reli parri say difficult get right game definit get better stori combat perspect get around middl youv got forc abil stori charact start becom interest
gngpcav,Games,cyberpunk develop like year onli
gndvqxw,Games,play yakuza game back back like other
gngc3w7,Games,near year sinc play disco elysium soon start listen song made super nostalg definit best game play year hope finish it
gnee0vv,Games,far cri assassin creed fps certain second episod infam ubi formula realli appear third episod one kind odditi alreadi bit open world shenanigan realli bare bone aspect unforgiv experi sometim detriment realli uniqu game especi come ubisoft mayb tri push bit youv unlock thing understand game bit dont expect huge shift repetit game dont like gameplay loop go nightmarish slog
gnnbmpj,Games,oh god rememb play got chocobo nightmar go back forth pray return wake sand love ff love gameplay dungeon trial especi hw stori inde get good god msq quest structur alway aw keep play love dungeon much interest stori never get better send u back forth talk peopl kill mob make walk feet go talk unimport npc give unimport inform back kill time would favorit game time made quest structur better still excel game though ever enjoy mmo especi stori
gnj7vbq,Games,biggest critic dont feel like split screen actual add anyth game anyth detract suspect although might wrong kinda point design throw gamer cant focus side onc
gnj33ra,Games,tri pokemon rom hack pokemon unbound great
gnlsbae,Games,game amaz earli access optim moment fps place ti rare ever go fps that natur earli access said game deserv prais get real gem make sever perform issu dont seem widespread
gnlytbb,Games,run nativ res max qualiti without issu driver date
gnmg70r,Games,cpu bottleneck mayb
gnmv0wo,Games,dont know fix problem feel like your kinda disingenu game bare function clear case major peopl kinda weird claim bare function doesnt run well dont xx xx card run well im play friend right run quit well us im averag like fps rare drop seem fair random im tri claim game perfect clear need work optim feel like kinda strang tri discredit everyon experi game like someth end
gnlmrdo,Games,odd remind us surg popular valheim good wouldnt paid current state game refresh realli what drive popular see lot peopl main use hous simul rather explor content world fine game allow freedom choic im excit futur im wait play home hearth updat need context optim focus finer detail depth game
gnnjlgf,Games,regard thor odin think save futur instal
gnnlfrj,Games,thor show post credit scene
gnntrjz,Games,there urgenc requir think point open world type game stori lack urgenc fit better ignor main quest dick around look loot etc
gnnklsl,Games,treat definit recommend play easi normal get stuck fight
gnhrsyd,Games,most basketbal podcast listen play watch listen everi week incred ps love kinda funni gamescast interest subject
gnimqgj,Games,crate crowbar podcast nice game podcast shut sit down podcast board game
gnj89tl,Games,shooter use sound much battlefront cod team deathmatch clash mode spellbreak overwatch mysteri hero main fall guy best rocket leagu mario kart ctr fight game trial seri trial hd trial fusion etc best one want someth focus gameplay gameplay kinda becom mindless focus convers use podcast need grind someth game like persona royal anytim need grind palac memento would throw podcast
gne4pbx,Games,nah like minecraft terraria your world unless join server peopl ive heard charact progress carri offlin onlin nice
gnnma3c,Games,world assassin hitman game think peopl look back absolut favor malign absolut wasnt direct fan want seri go cours correct lot peopl will enjoy is
gnjro29,Games,thought stori incred person drove finish game
gni3ano,Games,thought combat fine got realli repetit think game hour shorter might felt differ want see stori complet total worth lack varieti got me
gnjgwwx,Games,take advantag draw system bad advic your encourag take grindi approach
gngteiz,Games,oof that pretti bad luck good mine agre map smaller streamlin sure extrem daunt hard reveal long lol tough find balanc mayb someth like fallout start corner squar map get harder farther go littl manag merchant seem like shouldnt rng sure realli good item super critic especi co op still annoy sure notic swamp usual broken ocean could usual see swamp side water could theyr alway coastal im sure reveal map cheat consol command find big enough swamp sure revers though could make duplic map seed someth
gnims3u,Games,yeah enjoy first becom tedious stori difficult follow too
gniaw27,Games,zodiac age came game pass worth playthrough
gnjmpf2,Games,cant fathom got downvot comment bash x wonder peopl ever play x trainwreck gameplay complet bastard stori x havent play everi ff game one x easili worst got downvot prais xii suppos xii remain favorit sure didnt memor charact x vii man world xii still unmatch never beat kid got ps remak last year got past fell still blown away overal size scope game plus gambit system accompani rtwp combat plain great mayb programm satisfi watch clockwork team throw buff spell heal push simpler fight save complex tactic think boss high level hunt
gnijeml,Games,sure use knm suppos say recent start use partner pc final got play anno alway struggl rts game use control consol
gnja59f,Games,hmm dont get bore
gng58l7,Games,crazi cuz got worst part rout b rout perspect partner rout c onward total differ
gngyjdm,Games,peopl arent enjoy gameplay id probabl recommend watch youtub get rout b chore op alreadi done though seem silli finish rest point whole game would lot better rout b remov option playthrough could someth origin nier suffer similar problem got pretti damn repetit time got rd th end
gnj4tbr,Games,oh yeah absolut true say dodg everi time parri abl beat fight circl strafe onc
gnjui8f,Games,idea love first game back s
