id,subreddit,body
gqphji5,Games,right asset almost certain creat vita screen mind perform might suffer art wouldnt
m3k2l7,Games,
gqp752k,Games,fastest sell unit sale nativ english speaker wouldnt better word call fastest gross biggest gross rather fastest sell fastest sell sound like someth sell unit
gqp9dax,Games,non dollar sale us
gqpmngp,Games,im happi ps way previous new consol signific reason backward compat improv ps game sinc never got ps pro plenti play hadnt play even store ps game extern hdd load everi ps game ive play way faster ps ps enough notic almost everi time nut me
gqpu6h2,Games,imagin work year new video game consol launch coincid global pandem peopl absolut desper way kill time dream
gqpbo0z,Games,wonder percentag sale scalper there probabl way put number matter term sale would interest see
gqprkzg,Games,wonder much money would made actual stock would negat effect sinc sell loss
gqpe40k,Games,fuck dont cant even get line get line onlin
gqpl3dt,Games,ill wait month year game start come dont follow differ twitter account discord server get notif chanc buy one
gqpfqep,Games,interest total number onlin player ps would tell us mani peopl actual use them
gqpx57p,Games,avail u still myth
gqpdn78,Games,odd enough abl buy ps multipl time friend actual find seri x stock
gqpp8fa,Games,ironi might near top list term profit revenu per unit sold like never know sure safe bet profit margin per unit tini case point nintendo sure make money per switch soni current make per ps switch built increas cheap compon part silli point convers general real money softwar subscript servic peopl gonna consol purchas real takeaway soni clear well situat make ton money ps grow instal base stretch
gqpegdv,Games,dont get peopl fix get consol seri x mean consol game tech demo remak remast thing chang graphic ps game peopl want bad get noth return right now
gqppq9r,Games,redditor said releas game like horizon dawn pc devalu playstat brand lead peopl buy fewer consol
gqpkh0r,Games,meh consid ps lean toward new xbox announc abl play steam game xbox plus xbox bought bethesda usual cooler mod option game
gqplghi,Games,everyth ive seen far shown tini lead xbox ps us realm sourc googl pick articl factor mani xbox seri sell ps would definit lead us dollar sale
gqp81ca,Games,gonna laugh microsoft spend billion bethesda still get outsold soni generat x billion xbox would outsel ps million unit break even
gqpkqr5,Games,talk sale actual went egregi amount sale revers due stock system issu
gqppkuv,Games,cost ps even sell number consol perform better ps fastest sell term unit sold would better measur
gqp97t8,Games,highest gross first x month itd way easier understand titl
gqpgslw,Games,fastest sell unit sale wii probabl
gqp89hx,Games,id agre fastest sell would make sens say fastest million unit sold highest sell make sens unit sold specif time span highest gross make sens your talk figur consol dont standard price time
gqpi0f5,Games,ps wii due suppli constraint ps actual sell less ps compar launch window
gqpin7p,Games,compani want find evid show new thing best thing time new product posit metric youll hear it
gqppqs6,Games,definit wii sale fell cliff after
gqp99ru,Games,fastest sell headlin like make soni fanboy share news social media ign get sweet sweet click though qualif matter
gqp9wjp,Games,unit sale
gqpa3q2,Games,unit sale
gqpo12h,Games,ive go replay bing ps game mention half ps collect hadnt play consol generat saw point get consol first year let alon launch day sinc itd bare good game mention couldnt realli afford previous gen lol ps ive alreadi got plenti juic even without buy singl ps game extra like higher qualiti built record stream nice edit im sure pc player would read go pffft welcom weve sinc dawn time hey nice consol space even limit fashion
gqppkqn,Games,ps ps pro ps pro got still problem cool fan nois etc ps faster load time whisper quiet
gqpth54,Games,reason im enjoy seri x improv lot exist game like make fps awesom wish exclus didnt exist im sure consol bunch soon enough
gqpkf4h,Games,consol went scalper articl https screenrant com ps scalper sale resel mani percent fraction
gqpfts9,Games,mean scalper would count toward regular sale theyr count separ would that
gqphmdi,Games,probabl small percentag
gqpi4yo,Games,realli matter soni scalper make amount money consol end resold hand custom way other dont think promin honest
gqpeaua,Games,sold
gqphzdg,Games,well sell well
gqpgbyr,Games,believ read compani manufactur capacitor soni microsoft materi shortag dont see improv late august provid im rememb right believ that keep tri follow stock updat twitter page stuff that still took near month hop everi time stock notif eventu got go best buy tomorrow pick mine yeah luck worth bit patienc
gqpmhbo,Games,peopl buy faster soni make them
gqphtoa,Games,follow https twitter com ps stockalertss put notif got lucki earli saw ps direct queue form manag snag one
gqpmf63,Games,fuck dont cant even get line get line onlin would wager last year creat ton new gamer
gqpf2cy,Games,discord stock server ive gotten friend fair easili way follow wario twitter setup notif tweet ps perfect possibl get stay stock min time like gpus sell liter millisecond
gqpt7lr,Games,abl pick gamestop week your okay pay bundl seem like your compet autom tool use scalper saw lot peopl comment twitter success pick bundl gamestop
gqpn78z,Games,need new pc lot reason couldnt get ps either bought msi trident connect tv like consol set boot big pictur steam dont need mous keyboard im blast rtx everyth k run great that dealt get move pc realm edit dont know im get downvot im say pc better present way work me
gqplsu9,Games,exact wake follow twitter user get deal opportun pay full price
gqphiur,Games,your talk scalper whole point buy sell like theyr hoard fun
gqpl9q7,Games,soni mention last financi quarter coverag ps owner own ps plus give idea
gqpgzu7,Games,actual import would give idea mani ps still box shitti scalper
gqpo42i,Games,ive found opposit canada ps vanish second seri x dont even help friend anymor sinc seri x latest restock exampl last hour seri restock last entir day stock tracker claim unit begin https www reddit com r videogamedealscanada comment zuvh walmart xbox seri x stock
gqpem52,Games,wonder region thing rememb kinect came brother concern abl find would see full shelv everytim went out
gqpr3am,Games,consol loss leader margin negat eat cost averag user make elsewher case multipl generat xbox playstat
gqpg564,Games,person got didnt get ps want ay exclus
gqph938,Games,reason certain noth feel complet satisfi purchas demon soul pretti crazi look sound want get next gen experi usual mean graphic astro playroom super long delight ps game ps often better without effort develop start ni kuni ps finish ps frame rate issu ps pro k ps power game patch made ps mind mile moral look great ran realli well got control ultim run smooth fps god war fps uhd blu ray player nice im peopl ps doesnt sound like jet engin sold ps rather year got decent amount probabl wont net much year time wait even year buy ps save there good chanc still hold probabl wont even save money start enjoy benefit worst case scenario drop even happen id glad pay ps instead hold onto ps year longer
gqpgkgb,Games,friend got ps first ever consol couldnt get hand xxx seri gpu gave build game pc anecdot gpu deficit could factor
gqpgd5v,Games,dispos incom money isnt concern would like abl play current ps librari ps improv well hand thing im interest ps like ff r intergrad ratchet clank yeah demon soul remak
gqpq26i,Games,describ everi consol launch
gqpk8gz,Games,case got without issu preorder first option doesnt realli appli sens crazi regardless gonna buy eventu anyway unlik get signific price reduct least coupl year figur might well go ahead enjoy ps game exist futur purchas ps month offer better perform mani case ps collect good incent alon gave around whole new game play month
gqpgpuf,Games,demon soul ps absolut worth ive alreadi beaten time
gqpgdwd,Games,ps borrow brother play bloodborn spider man far gotten play demon soul spiderman dlc spider man mm god war bf ghost tshushima fps cod adapt trigger persona royal nioh start ff control pc main apex wow month ps definit paid imo
gqpfqlq,Games,wait buy ps right spider man came time abl find pro get exclus discount definit ps would love right arent enough game cant alreadi play almost equal fidel qualiti pc warrant tri hunt pay scalper price
gqpgicp,Games,main reason want sooner rather later play ps game faster load screen less nois
gqpo6wu,Games,got seri x know there gonna game line ill want play game alreadi run much better it
gqpqja7,Games,interest mod recommend take dive pc abl mod basic restrict
gqpm2j3,Games,wait steam game xbox offici announc ms figur sort hack would shut soon
gqpmn2b,Games,googl say ps sell xbox us like
gqp8luv,Games,mean soni almost certain sell microsoft gen xbox game come pc simul releas mean need xbox
gqp8xfy,Games,bethesda softwar xbox hardwar clear microsoft hardwar gen consol pc xcloud real winner shown profit margin consol sold success
gqp8m1r,Games,remov
gqp8y1e,Games,money isnt consol sale get sign gamepass buy stuff xbox store billion reason believ microsoft isnt worri xbox profit edit obvious worri futur will take loss right moot point
gqp8idy,Games,kinda braindead take clear consol maker make money game sale servic like psn rather sale physic consol even clear playstat even make profit consol sold
gqp9p22,Games,happi ms buy larg develop level consolid isnt good anyon long run kind view somewhat simplist cant look kind stuff direct x way thing ms buy mojang make money back right question money best thing help futur strateg invest break even xbox sale alon revenu zenimax game edit quot mojang buyout explain quit well well billion interest million year say break even dont mean theyr go get billion back that sunk cost dont care theyr talk gaap report perspect ep microsoft corpor make minecraft lose money bank generat interest
gqp8i7y,Games,remov
gqpazmx,Games,realiz soni microsoft make loss consol sale right money alway softwar servic sale
gqp9nku,Games,know compani lose money sell consol right theyll make later sell game subscript ms tho make money game subscript pc mobil xbox market
gqpifys,Games,there much wrong calcul isnt pure profit consol make life seller game sub mtx cut didnt buy bethesda microsoft clear strategi softwar orient hardwar orient dont worri im sure trillion dollar corpor studi billion acquisit strategi littl redditor kind data dont even know about
gqp9806,Games,realiz microsoft care straight outsel soni right game xbox pc mobil way stream revenu soni need buy xbox make crap ton money
gqp9jv8,Games,remov
gqpbxqd,Games,let break argument lot microsoft soni sell consol loss recoup loss mani way subscript like gold ps gamepass ps first parti game sale dlc mtx cut rd parti sale revenu brought consol adopt mean profit hardwar make profit alway mean except nintendo alway sell hardwar profit microsoft doesnt sell consol alon even soni begun move away microsoft market major game space space exist gamepass mobil mean cloud current android soon io pc mean store steam allow xbox live integr authent matchmak best seller steam revenu unit includ new bethesda hold cloud support come low power machin consol budget hardwar option seri enthusiast option seri x phil spencer impli want see cloud stream come consol well option necessarili instal game smart devic support soon confirm bethesda round tabl done cloud put microsoft everi major game market option consum see compani like sega soni move pc well market deliveri make sens indirect revenu mayb track concept bethesda actual make back b sale alon common fallaci econom come acquisit merger push consol adopt good understood concept mention market get rich back histori gamepass solid output base futur exclus content great consol doesnt help consol alon state gamepass engrav everi market soni sell hardwar microsoft deal still huge financi success ensur content servic everywher game everi new gamer xbox consol come bethesda isnt go play bethesda sub gamepass gold go buy st nd rd parti content generat revenu outsid bethesda caus acquisit bethesda caus revenu game alon microsoft still need prove true peopl need see game consol buy come generat consol space pretti crush soni deliv well game truli seen hardwar behind competitor albeit bit closer featur set
gqpq6qp,Games,game pass key microsoft entir play entir feasibl microsoft could game pass subscrib year ps sold year gotta keep mind market like china quick becom world market video game buy consol play pcs phone tablet microsoft well pois captur grow player base focus consol side miss forest tree least term success look like microsoft perspect
gqpap6o,Games,sell softwar bethesda softwork biggest releas ever
gqpeirh,Games,consol sold loss leader your compar softwar divis hardwar divis microsoft launch game pc stream servic simultan provid multipl revenu model hell go yes consol unless your go includ entireti micrssoft game divis compar soni stop
gqpcn5v,Games,comment amaz
gqpfypg,Games,dont think ms care hardwar sale near much anymor dont even releas hard sale number care grow servic xcloud game pass help power consol seri x alongsid afford consol seri target largest percentag gamer
gqp98jp,Games,talk soni outsel xbox problem probabl even think overestim bethesda bit lol especi flop recent year ps near sold million without gamepass without sell consol appl egg buy consol still without first parti game tes game mayb come year mayb decent that big mayb best definit way play bethesda game pc either way peopl ps get horizon new spiderman game god war ragnarok new naughti dog masterpiec near futur compani stellar track record everi releas big goti content
gqpcnw8,Games,lmao care consol sale otherwis releas pc push xcloud much long peopl ecosystem subscrib game pass happi look strict consol sale pretti antiqu point
gqppxox,Games,even wouldnt realli suggest new consol popular point produc unit id imagin wont great pictur popular ps xs enough peopl store abl actual keep stock
gqpseuq,Games,ds possibl
gqpndlm,Games,interest hear sinc soni claim outproduc ps unit wise
gqpsxfx,Games,thought soni said ps outpac ps sale realli matter guess id assum would shortag base semiconductor alon
gqplo4n,Games,claim come market research compani
gqpn0dy,Games,never chang reddit
gqptho4,Games,g unit
gqptp9f,Games,look game pc alongsid ps consol game still notic nice
gqppuy5,Games,that larg
gqpqbvf,Games,insan number
gqpnctg,Games,awesom thank link sound right
gqpg3rm,Games,said said would interest see
gqpthad,Games,driscol analysi uncov hand amaz data point perhap import conclud around percent ps sale us resold websit like ebay stockx addit percent sold offerup facebook https gamer com ps consol scalper profit text overal c found marketplac like ebay stockx platform alon lot see scalper sell instagram lot im sneaker world lot sneaker resel becam ps resel im sure place theyr sold im expos yeah like like
gqplpoz,Games,think reason percentag like
gqpibrn,Games,actual dont dont buy game get extra thing like ps plus
gqpnon6,Games,doesnt matter curious anyth anoth user post articl https screenrant com ps scalper sale resel mani percent fraction say right around launch
gqpi7j7,Games,quick ive heard
gqpf8yv,Games,mind name stock discord
gqpgmh1,Games,eventu got dont stay stock minut your lucki time last second
gqpjqg5,Games,ive tri hard last month half sell second follow sever stock updat twitter account
gqplbe6,Games,manag get direct thing playstat site yesterday week immedi tri costco gamestop walmart right notif came minut stock second like gpus
gqpl4zx,Games,stay stock min time absolut tri daili month click add cart button second restock disappear time go next page put inform
gqpigc0,Games,truli shitti scalper arent turn around sell actual user hour day longer hold consol risk soni deliv consol drive aftermarket price down
gqpiawz,Games,scalper resel consol what point scalp keep consol wasnt sell would stop scalp long time ago
gqprpb6,Games,that awesom yeah talk us follow wario account twitter success gotten ps drop far struck seri x go tri trade unopen ps cant find time return date pass
gqpriwe,Games,would see full shelv everytim went see full shelv seri x right probabl know someon area ship most talk onlin sale seem go stock immedi drop dont think would region thing
gqphfmw,Games,yep dont consol right hard convinc buy ps know ps out
gqpgq7d,Games,improv like automat like seri x vari game game
gqphazp,Games,demon soul fun beat time play havent realli touch ps felt like game play year ago prettier
gqpmrqe,Games,talk thing that via geforc nvidia game stream servic nativ run steam app anyth like take advantag gfn access web browser dont think there sort offici announc hell even possibl oversight microsoft part
gqpn4yh,Games,remov
gqpggw9,Games,unless your person foundat game pc case seri x still go cheaper jump point hardwar wise play new bethesda game that still decent size market
gqpbv3c,Games,simul basic everi game xbox pc nativ
gqpdiyt,Games,playstat make bulk money softwar sale make money xbox nintendo
gqpb0nk,Games,microsoft isnt worri xbox profit microsoft absolut worri xbox profit lol worri wouldnt bother invest certain wouldnt invest money area busi didnt believ could make back profit
gqpdhn4,Games,microsoft pay employe studio like cost million year oper
gqpbqm7,Games,microsoft absolut worri xbox profit xbox money maker xbox liabil microsoft use window offic cover xbox loss year start xbox lose million https www fanbyt com news xbox q fy sale down
gqpc46b,Games,hear consol sell game servic sell
gqpuyys,Games,pleas read rule https www reddit com r game wiki rule specif rule regard person attack inflammatori languag ask rememb remain civil futur violat result ban
gqphlxo,Games,make money softwar servic consol henc theyr will sell loss dont understand point your tri make
gqpdoan,Games,way stream revenu soni assum mean term pure videogam soni sell movi electron phone financi servic
gqpe0rr,Games,remov
gqpe8yn,Games,appreci long write soni move pc youll like see game blockbust move pc would move window soni isnt go team biggest competitor ask see soni googl team linux cloud game stream etc
gqpq5op,Games,repli wrong post
gqptjj7,Games,ps would guess
gqptl8e,Games,switch might avail unit launch
gqpvayr,Games,ps bigger launch suppli volum drop wherea ps abl maintain reason steadi suppli result surpris ps fallen behind ps per day sale point xbox seri x experienc shortag definit driven suppli chain issu apus
gqpq5h7,Games,yeah peopl talk sure that main reason peopl cant get that still pretti insan
gqpmltg,Games,doubt million ps unit sold realli think million scalper
gqpj86g,Games,person buy consol scalper scalper purchas still lead incom stream eventu
gqpjl2g,Games,consol end resold hand custom way other end exact thing scalper dont stay consol hand otherwis would lose money would stop scalp consol long time ago
gqpombc,Games,fortun enough grab ps last week first attempt queue game restock decid realli fortun time correct knowledg where gonna restock next get queue fast enough friend went restock split second behind get queue soon got allow order everyon els left queue got dump liter last get restock friend final got secur back order day anoth site shed tri way longer keep track like restock realli miss time get queue
gqpgarh,Games,hotstock app got mine notifi soon drop target use phone peopl seem success way
gqphuwy,Games,spieltim good one
gqphzde,Games,nuka ps chat got total disc ps first month use enabl discord notif phone time faster warrio tweet
gqpmm5c,Games,that thing scalper tell feel better anyon want get easi got mine kohl drop thank
gqpm1jr,Games,street price fall im economist base econom class year ago colleg fall price expect suppli increas demand remain same
gqplr85,Games,yeah whose buy scalp consol check ebay post ps post multipl consol sale bot still grab consol soon go sale scalper still problem buy consol keep market bare place get threw scalper
gqpq9ud,Games,mean ps ps plus top youll get pretti signific portion best exclus ps cost plus subscript yeah id definit say worth patient monetari perspect
gqpjjwn,Games,vari seri x well everi game get improv although common xbox side overal certain case game improv ps xsx due inher limit game ran last gen consol like dark soul run fps ps got ps pro patch unlock framer stuck seri x never got equival patch x
gqpigex,Games,like seri x improv automat big improv game game dev need patch
gqph39n,Games,vari game game far know
gqpql6z,Games,fair qol stuff bluepoint didnt realli chang anyth core gameplay demon soul game play year ago prettier fair assess pretti damn good game year ago though
gqpnt7m,Games,remov
gqpc7ud,Games,meant simultan releas got autocorrect assum halo infinit launch play game pass pc
gqpdr46,Games,yeah know accessori think
gqpbrfz,Games,worri futur profitabl sure incred agress right attempt gain market share increas instal base sell gamepass there way xbox divis turn profit year soni nintendo could never could xbox independ own much smaller compani microsoft
gqpcdjy,Games,well didnt lose million revenu decreas million year year yeah obvious care futur right will eat expens cost set gamepass futur moneymak
gqpj0yq,Games,start xbox lose million havent read articl even headlin revenu doesnt mean lost still revenu b dont know much profit loss sinc isnt report overal profit b per quarter that xbox
gqpdprd,Games,bingo peopl delud think xbox doesnt care consol sale
gqpj5kp,Games,gamepass access pc io android probabl soon elsewher consol anymor
gqpdha5,Games,yes point half target market even less steam becom popular requir consol pc
gqpg5fy,Games,microsoft bet everyth gamepass main money spinner potenti reach way peopl soni consol
gqplm17,Games,xbox ecosystem xbox consol dont need sell mani consol soni even simpl consol sold x amount softwar servic sale regardless op point stupid base misinform that point
gqpg60b,Games,user base linux worldwid signific smaller window especi look game market
gqpvgfn,Games,yeah make sens
gqpo0ga,Games,someon might know said believ https arstechnica com game scalper arent main reason cant find new consol there financi reward isnt illeg make sens huge number peopl secur order resel
gqputc8,Games,dont believ million purchas scalper think higher walmart best buy target sell second put stock onlin end consum get lucki soni direct queue system jump immedi hour normal peopl click half second window avail e bay price consist stay around lot consum abl pick consol retail price onlin centric sale process scalper dream come true compani could implement system stop perspect sell consol quick process ensur consol purchas per person would cost money cost eat profit incent potenti loser corpor level soni scalper dont buy softwar probabl figur consol wind end consum home eventu soni start sell game make money
gqpmont,Games,mayb scalper actual manag sell unit buy gambl unit actual sold consum direct
gqpmcze,Games,except person bought scalper less money spend soni mayb mom wouldnt bought timmi game go it
gqpvsfd,Games,realli come dumb luck manag score best buy black friday stock happen wake bad dream sunday beforehand check phone saw gone said seem good system prevent scalper took like minut round verif could check went back sleep woke wonder anoth dream
gqpmq8p,Games,mind drop link quick googl doesnt seem show up
gqpqotr,Games,impli im scalper lol okay mate
gqppz0a,Games,plenti peopl scalper exist make money it
gqpm5dh,Games,sell million upon million consol ebay list noth
gqpmdc6,Games,scalper still problem resel peopl obvious buy otherwis would lose ton money
gqpv1cf,Games,see exact whos buy system go ebay search consol sort sold list tell complet record sale platform item
gqpo6i2,Games,remov
gqpdwla,Games,ds dualsens rake cash
gqpci9u,Games,there way xbox divis turn profit year mean probabl dont think billion came oper budget year
gqpgkw8,Games,sure shit spent past year develop next gen consol care consol sale
gqpqcjt,Games,consol though your ignor pc xcloud
gqppx6n,Games,need sell enough point sell loss laughabl say someon els say someth stupid base misinform tri underst someth simpl import
gqpntyw,Games,wouldnt didnt sell
gqpr2nv,Games,theyr hard sell all
gqptk2q,Games,scalper actual manag sell unit buy knowledg current tech market situat haha ps would sell second put onlin bought realli think new graphic card dont sell huge premium delusion
gqpn0gm,Games,kind person buy scalper probabl break bank spend instead ps
gqpvnuz,Games,https discord com channel
gqposc6,Games,remov
gqpd1u0,Games,ms doesnt report profit expens xbox divis pure revenu dont think need bill anoth divis
gqpqoob,Games,id bet major gamepass custom consol easiest conveni way push servic
gqpn5v6,Games,think desper parent werent buy christma gift
gqppkju,Games,remov
gqptc9a,Games,gamepass pc absolut huge ms month sale long must kept lot custom
gqpra9u,Games,doesnt matter much long gamepass though gamepass alreadi ultra success pc even though new
gqpolcx,Games,lot desper parent buy scalp ps sure wager most well peopl think number parent live paycheck paycheck buy ps ebay pretti low general seem audienc scalp product peopl dispos incom bother spend higher price
gqpqj5i,Games,remov
gqpu86o,Games,mine expir pretti soon buy deep sale like deal
gqprcsr,Games,need consol sale push gamepass consol
gqptuy6,Games,wager most well peopl friend scalp consol definit well peopl say vast major sale go work class kid desper want ps usual drive older economi class car
gqpsgoy,Games,remov
gqps8tu,Games,yes fixat consol entir point consol isnt big deal microsoft success ps would soni long ms sell gamepass pc xcloud theyll make coupl million theyll lag behind consol sale seri xs sold import end microsoft unlik ps soni quit liter microsoft entir strategi
gqptkx8,Games,remov
m2wqye,Games,
