id,subreddit,body
lznoda,Games,use thread discuss whatev game youv play late old new aaa indi platform atari xbox pleas dont list game your play comment elabor thought game make easier user find game your talk put titl bold pleas make sure use spoiler tag your reveal anyth game plot signific impact anoth player experi play game matter retro recent game find instruct subreddit sidebar thread set sort comment new default obligatori advertis subreddit devot type discuss rest week pleas check r whatareyouplay r game discord server feel free join us chit chat game https discord gg zrpaxtn schedul discuss post week play https www reddit com r game searchq author aautomoder titl play restrict sr sort new monday themat monday https www reddit com r game searchq author aautomoder titl themat restrict sr sort new wednesday suggest game https www reddit com r game searchq author aautomoder titl suggest restrict sr sort new friday free talk friday https www reddit com r game searchq author aautomoder titl friday restrict sr sort new all
gq3yd69,Games,mass effect conclud mass effect trilog run week finish final game see earlier comment thought mass effect https www reddit com r game comment ljlr h week rgame discuss gngyx k utm sourc share utm medium io app utm name iossmf context mass effect https www reddit com r game comment ly omi daili rgame discuss free talk friday march gps kr utm sourc share utm medium io app utm name iossmf context know mani folk consid weakest mass effect game say might favorit definit prefer mass effect improv everi element predecessor falter deeper rpg element focus plot remov tedious loyalti mission much better squadmat interact better level design fact biowar deliv top epic satisfi genuin emot stori conclus speak talent casey hudson vision hard write good conclus mass effect absolut deliv epic closur fault shepard dialogu predecessor sought make shepard blank slate mass effect feel bit pre defin languag dialogu wheel feel loos connect shepard deliveri feed shepard suggest rather actual command shepard dialogu dealbreak fact admit conceit entir trilog mass effect hardcor crpg never intent even first game blockbust video game epic dialogu choic mass effect refin formula essenc want clear play game major dlcs dlc felt essenti discuss vanilla game someth never experienc review mass effect today earli honest blown away mass effect satisfi emot ambiti stori conclus ever play think galaxi long time carto play big game puzzl game game pass good tastebreak epic rpgs play late blown away cute littl world good puzzl
gq3x1pi,Games,ive start star war jedi fallen order im love first star war game ive ever play ooz charm
gqa1dea,Games,yakuza game amaz love combat stori side stuff minigam finish chapter im think kiryu majima interest charact end chapter excit see happen next majima stori problem find game hate sidequest done game think execut perfect dont feel like filler substori uniqu fun hell kamurocho sotenbori live drip atmospher love explor citi look new substori collect phone card hear minigam probabl best aspect yakuza game see minigam comic outlandish either majima kiryu realli get sinc week spring break lot free time im probabl go spend major play game even finish game damn good oh start real estat royal pretti cool kind remind manag mother base mgs peac walker phantom pain
gq36vea,Games,xcom long war mod fuck good ive play year still regular come back anoth campaign depth content phenomen money dev manag get balanc right campaign stay fun engag whole way give hang thread sens danger your still progress right final manag snatch desper victori still fail campaign ive start new campaign im good spot first month ive got assault scout run around nail sectoid alien havent start throw anyth serious like bloodi muton definit rank dota counter strike dayz best mod ive play
gq32tdo,Games,loop hero nice fun game great play im bing netflix pay much attent im rubbish though loop fun arkham asylum origin citi damn even high rate game still feel dont rate high enough go back didnt know theyd hold fun consid dont spiderman ps give superhero kick despit origin worst rate actual think possibl favourit first stori charact great arkham knight look amaz feel amaz love feel batmobil new fear attack love well design everyth easili best lot except pc doesnt work play old gtx ran fine new rig run terribl perform amount crash annoy bug ds stop work random config file got written probabl averag crash everi play session infuri point game seri probabl wont complet though play twice befor
gq5719i,Games,valheim cant stop play game almost alway someth work toward privat server friend blast mani day week loop hero bought whim im honesti surpris addict combin card game idl game swap gear fantast dont let simpl graphic turn away life suffer sir brant pick adventur book mix rpg element havent gotten hour im like far hope hold play game well ive spent time week one
gq3w08j,Games,done aw job finish game move next recent year especi busi schedul glad final got play finish sleep dog definit edit combat great camera headach overal absolut love though start persona royal friday usual jrpg art style mix music acclaim amongst fan made wanna tri still earli game realli like lot gonna best make time play much week
gq7xllv,Games,mindustri bit year sinc last play game wow lot chang v seem bring lot balanc chang well thing get complet rework game fun like slight less complic factorio build suppli line feed turret machin power lot fun tech tree slowli unlock great way drip feed new unit featur im sure like planet map honest littl hard navig forc rememb name place make sure dont jump alreadi complet map said im love stick around map win indefinit fill forget name command center resourc bring next map still lot mroe game go dev arr great job expand game look forward gunfir reborn huge underr roguelik fps lot fun weapon fun affix lot enemi boss blast new charact lot fun look sort want dev rework cat cat first charact made show skill tree abil doesnt near well design skill tree make build near complet reliant right weapon rather charact reli right abil choic small relianc weapon type said game fun multiplay mad scrambl damag despit incent doom etern thought would play anticip tag part imo etern greatest game ever made isnt game exist good gameplay etern unreal adrenalin fuel romp
gq4e0qh,Games,finish main game nioh pc last night realli enjoy first game game think high combat system nioh first game better overal think perfect approach sequel enemi type better level design new fun game mechan burst counter dark realm new weapon realli fun boss fight visual appeal nioh hit right note near everi regard im glad final got play high recommend give shot great time
gq87i6u,Games,horizon dawn pc solid fun open world action game stori far surpris interest biggest downsid think quit formula play pretti safe youv play assassin creed game there much new horizon gameplay wise
gq4p100,Games,monster train month cant quit like roguelik card game alway feel control happen champion combin wack tho aint go way would like star fast pace game clubhous game richii mahjong dont know happen im addict mahjong blame yakuza fire emblem hous start play recent cant realli form opinion love crash team race nitro fuel better mario kart mayb harder master alway feel like control outcom littl kart race blue shell bullshit load time tho pain long wish avail pc instal ssd oh well still enjoy experi sonic team race hand suck hardcor whenev feel close win knuckl fall back send teammat good item drive straight line easili boost still cant keep team mechan broken happen sonic star race transform hotshot race good game sonic team race nah good tri innov someth alreadi solid fail epic
gq5ekgn,Games,untitl goos game nz psn store kinda expens even sale great littl game task fair easi youv mess around level see interact complet bonus task speedrun good challeng thorough enjoy co op mode well thing better mischiev goos mischiev gees prey still slowli make way idea far stori actual im point alway reach game like im spend hour side mission without progress stori still great time although game lot easier get far enough abl make much ammo need havent unlock typhoid power either might complet run human stuff second run alien power
gq7o55b,Games,xcom war chosen lot fun start bit overwhelm lot go get feel various thing manag fun progress satisfi point handl thing assum careless unlucki yes miss coupl shot dont feel game unfair take shot around rang time mission arent bad frequent still plenti chanc overwatch creep thing overal good time
gq3skno,Games,ive beaten everi pokemon game least play pokemon red first time sinc beat kid still pretti fun like st gen pokemon feel differ special stat someth gyarado surf icebeam thunder still hillari like lot stori mid game order want game definit issu tho most fix later game learnset pokemon aw complet useless without tms funnili enough get lot broken tms way earli make steamrol major game bag manag pretti infuri dont even know mani item toss playthrough exp curv pretti fuck option trainer didnt grind wild complet overlevel nugget bridg way th gym immedi level rival top funnili enough wasnt issu pokemon still idiot use move whatsoev im pretti convinc older pokemon game realli werent much harder newer one less knowledg game lot case probabl lot younger
gq54f1v,Games,jurass world evolut gorgeous present manag aspect quit shallow stori mission fidd inabl speed time make rather dull well sunless sea start get got dull loop bare money keep make tini trip earn littl thorough unenjoy ive got past hope abl get back explor game meant about
gqejods,Games,kingdom come feel like im play dark soul franchis think ive die time sekiro hard recommend great game great resourc ambient sorri bad english
gqbryl8,Games,finish red dead redempt first time weird think game good exampl someth context wider game world stori make simpl even poor done thing enjoy like game experi shoot cover system bad ride clunki monoton mission design excruci rigid lot side activ camp craft downright pointless arthur morgan beauti craft world somehow make stuff thorough enjoy compel stori protagonist ive ever play game bar raiser talk day charact motiv heard mani peopl say main plot lack real goal give purpos focus meander futil kind stori van der lind gang come head beauti last act game need time patienc though need calendar pretti clear thank wfh social commit mine see mani peopl get frustrat general pace rat race commut socialis like pre pandem im sure id feel spend hand hour get game week watch arthur labori pick can bean manual pull rifl hors saddl might thrown ps window tough day offic mundan task epilogu lol overal realli realli memor move experi without lot littl frustrat game play hope next outing rockstar find way still tell stori want give player littl creativ freedom approach task mayb bit modernis thing feel control
gq5xin9,Games,desperado most play desperado apart apex huge commando fan man game good good
gq63ozq,Games,brave default tldr hour finish chapter im realli enjoy detail breakdown stori charact far game isnt go win award wasnt realli expect much bd bs pretti meh though admit got halfway say im enjoy bd stori charact much either previous game activ dislik cast bd bs im find main cast bd endear term stori prologu pretti lacklust feel like anyon ever play jrpg couldv seen betray prologu chancellor death gloria protector castor turn baddi expect anoth oh chancellor betray us stori beat addit anih ador orpheus perfect kind punchabl douchebag castor laugh like maniac felt like second realli amus gameplay ive play hard thatll color opinion combat job system ton fun expect ive got job im alreadi work toward fun combo ive found boss far quit challeng fun strateg around main complaint counter wouldnt mind much show boss counter analyz like chain battl system game lot bs could chain togeth battl wipe enemi turn led pretti dull random encount opinion end goal strategi pretti set stone bd use item make chain battl chain battl happen whether take turn turn kill enemi mean actual use differ strategi fun realli enjoy underdog bonus system get bonus exp jp enemi stronger dont rememb game dont think side quest rang realli good god aw quest give bit lore charact develop point new dungeon option boss even reward new job other go kill goblin antidot lol soundtrack soundtrack amaz bd amaz music bs okay glad get return form current favorit track gloria special attack theme https www youtub com watchv yvlez cda asterisk boss battl theme https www youtub com watchv amvi zxtkxw misc idea game minigam spoiler card game pretti damn fun there weird lack polish area game somewhat laggi point ive notic delay like second transit parti chat weird design oversight opinion examin enemi give info could see enemi statist def attack mag def etc older game that gone monster catch system beastmast quit disappoint doesnt tell monster stock target doesnt even tell monster abil give name game lot weird minor flaw like make feel like couldv mayb use coupl month oven iron pretti minor detail
gq6fvsn,Games,dragon age inquisit finish replay weekend think realli appreci frustrat tickl imagin could like war tabl text stuff appreci mechan storytel wish way experi wouldnt interest see mage templar war close serious tone world war game set high fantasi like hasnt attempt old suikoden game battl skirmish dunno realli critic game much direct would like see genr fantasi game usual lone power charact rag tag group even leader ground still magic dragon lot chao confus like play helm deep someth anyway im gonna start look new game play could pick valhalla ff im feel im post game stage dont know want tackl next
gq3nr2v,Games,finish nioh good game clear almost except last dlc sub mission save mujina etc im big new game plus mode game rather clear backlog nice option might revisit game later love combat stori ass though like set charact stori bunch nonsens never grab like like idea behind execut lacklust dont like nioh stori either much prefer voic protagonist custom charact nice love charact creation stuff non voic kill stori fan graphic well messi lack anyth interest draw distanc issu well shit pop realli low rang pretti aw honest hard notic your focus combat still issu though want appreci view shit combat excel ad mechan great util yokai abliti shit satisfi play realli elev nioh way soul seri strict combat play main sword dual sword main game im dlc weapon unlock need profici dojo switchglaiv definit favorit like fist hatchet tonfa great well fan odachi axe splitstaff latter wors bad im fan hold button combo pretti uniqu though ill give anyway dont realli care stori much still hope there anoth nioh combat way good whether prequel sequel ill take anyth lol know game lore deep japanes histor sengoku period im big fan thank samurai warrior would love see modern japan set univers yokai exist x b current play control ive sit game im plan play upgrad pc im current lucki get rtx seri like enough far gunplay feel pretti great respons environ map confus travers well ill probabl get use layout play stori bit confus first definit interest know would develop know inspir scp foundat dont read scp much limit read ive seen far alley definit much content sift lol mayb ill look ive finish game im big fan twilight zone bright fall alan wake actual seek twilight zone bright fall lol im millenni third world countri tz arent exact known around graphic awesom overal present realli great ui look great crisp visual effect insan environ destruct well add cherri top ive seen complain control art direct bore big blocki offic build grey wall doesnt deserv award cant disagre game probabl gorgeous game ive play far though charact art need work imo bad couldv better cant wait play it
gq4prcm,Games,brave default ii still begin game work way first mini dungeon huge fan game remov qol featur poor perform switch realli take experi seem like load time old game im sure plus side like graphic far soundtrack improv brave second realli bland im sure reach high brave default soundtrack well see
gq779lm,Games,ghost tsushima hour act iii stori well done far although side quest seem slight ruin pace game got deepli invest storylin could mainlin avoid feel enjoy combat world much want experi environ side content even hurt flow main campaign game amaz overal complaint nitpick anyth excit play week thank yuh sucker punch apex legend group went town thursday week amount apex signific decreas still manag win put effort spend time train rang much miss lock load start get fatigu loot hour pubg blackout apex cod mobil br warzon fortnit spellbreak throughout last year taken battl royal break sad fatigu becom much apex realli good game cap day great late night convers fun boy would love anoth variat lock load care packag mode realli inject life game get tire loot ahem respawn pleas ahem fall guy ultim knockout still might best podcast game exist mindless game downtim alway fun mix togeth battl royal element mario parti style event fantast realli like epic busi practic think probabl overal bad industri stoke purchas mediaton guess see
gq3xpa2,Games,final got around buy hollow knight exact game need right art style good gameplay straightforward challeng realli great music atmospher
gq354if,Games,valheim good terraria fo build dark soul combat outer wild subnautica discoveri explor absolut live hype me
gq3647x,Games,hade dead cell rogu like enjoy enough continu loop time hour deep made surfac fail right interest dialogu complet find perfect build far best run deck zeus boon spear basic everyth rain lightn around use artifact let cheat death addit time bet beaten old man done far want collect fulli augment everyth brave default ii bare play sinc releas day start felt compel tri clear thing first know adher stori give spotlight mind build visual handheld gamer actual bit ugli due pretti granular pixel clue squar use ue switch never seem run well music dope kinda plain brave second score hyrul warrior age calam becom interest stori even though still find core easi corni stori vehicl guess appreci charact interact fun enough still like hwde better reason quest less linear requir bit itiner priorit sm dw bowser furi never play wii u realli enjoy world still thought land better game enjoy level realli like extra charact world onlin multiplay work realli well friend actual onlin switch game first time sinc mhgu start bowser furi sinc want basic dw first everyth except charact stage stamp like play far realli like bite size odyssey power up instead cappi ghost n goblin resurrect holi shit thank god squir difficulti beat super ghoul n ghost least could point life never beaten game good though play perfect tactil pariti old game hord relentless spawn realli wit addit spell use without need golden armor advantag earn bought gain versatil go littl pricey length even though stage altern shadow version even tougher trickier tri essenti doubl game length impress nostalg attent entir packag love illustr xenoblad chronicl definit edit play prior version n ds perfect decent improv way depth glam enough new paint job look superior old one without look wild chang play slowli know expect super driven chew like last time tri open mani side quest never complet prior playthrough save extra content end playthrough it
gq3a2xl,Games,remnant ash idea soul like gun felt appeal first didnt feel chemistri play divis got use fast smooth movement remnant initi felt like im move pool mud hour got use start enjoy game challeng probabl signific easier anoth player boss fight make scream screen eventu far overcom whatev throw addict
gq3dn79,Games,im final stretch nioh use fist major game read hype littl disappoint attack skill felt littl samey switch tonfa want check sinc nioh man thing fun skill feel distinct use wear light armor alongsid sped combat notch use brute yokai form switch phantom parri like yokai counter feel much easier use brute slow club awesom game like nioh lot sequel feel like fix almost everyth didnt like everyth except loot still feel littl meaningless first playthrough feel like fewer meatier stat per piec would much engag like straight bonus someth instead bunch s
gqb211v,Games,play lot loop hero sinc came super fun game half pay attent watch listen stuff time got nd boss slowli build camp love feel like im go super slowli hour nd boss kill im realli enjoy got atlanti dlc titan quest im huge fan arpg game grim dawn fantast titan quest realli show age decid play caster feel super weak whenev play mate whos throw weapon charact goe past throw enemi get poison die even get cast might make play grim dawn sinc hadnt clear ultim difficulti play caster game leagu beyond titan quest main item think far tq im level still use super earli game level item pure there noth ive found give element skill damag intellig energi energi regen wherea grim dawn level youd sweet item feel fair strong ill probabl soldier sinc think ive ever made egypt never actual complet campaign definit becom fair averag arpg
gqdiayt,Games,divin orinig sin lost save third map kind rush game lone wolf assassin type silli much easier game activ chees encount realli enjoy second time around look forward slow get back still think fonder memori play first im look forward see stori end although ive kill number key charact play get full experi wish hadnt lost save could see canon charact stori resolv
gqezkno,Games,gave serious posit vibe final fantasi xiii https www reddit com r game comment kpi xw week rgame discuss gi q v enjoy lot thought would stori music dialogu graphic real sleeper hit compet much miss start lightn return pretti high hope uh stori dialogu deliber design embarrass nightmar nonsens doesnt even come close favourit main cast liter show de age adult child respons liter god work mysteri way uh despit plot stori base interact gameplay banter absolut aw game play pretti well like garb system wherebi chang outfit differ stat abil link kind like dress sphere final fantasi x almost complet posit ffxiii cant say feel way game everi thing right someth els realli poor think time tell game plot get good save uh interest game
gqgpxq3,Games,outrid divis meet warfram kind like quirk kind revers cover shooter cover enemi player oh sure use cover realli your god men cover thing give ai fight chanc frustrat captain caus major problem cant kill mook heal mission go trivial easi nailbit hard show frank avail id buy might preorder sinc releas demo good high recommend everyon whos even vagu interest cover shooter live servic game least give demo tri
gq3hbth,Games,witcher iii wild hunt play hour long love hate relationship game realli want enjoy like rpg mechan like much get play hour time get bore roam around potenti find someth someth involv enemi high level even manag complet quest get much besid bit xp even bigger issu though game feel realli clunki like everi way move sometim realli struggl posit loot stuff sometim hors move way want tri move toward path combat wors thing ever still great clunki help honest start see compani made cyberpunk good way said reason still interest play hope click sooner later
gq6rvx7,Games,red dead redempt pick rdr launch day play hour alongsid roommat made great memori share experi separ playthrough especi earli hour game sinc though ive pick coupl time im chronic backlog increas addict said pick back earnest first time coupl month continu blow away stagger achiev especi graphic im play ps havent gotten around play pc version sure ahem rapid age would handl even consol breathtak chew sceneri pleasur im realli enjoy im stori look forward hear realli realli good even im still earli roommat coupl late night straight couldnt bring paus stori guess expect high realli major barrier keep run aim game career shooter kb get absolut manhandl combat sometim anyway want share thought much look forward play come week
gq36dg1,Games,littlewood switch far hour definit detail full game worth peopl steam seem given moder good score agre much stardew valley terraria dark cloud crashland
gq53uik,Games,cruelti squad game gross aesthet wrap around kinda amaz gameplay wise kinda like deus ex hitman everi textur anim sound effect bad acid trip loop hero love game need x x option earli game slow reped mix gear swap deck build tile placement secret synergi realli hit loop spot
