id,subreddit,body
gq9aquv,Games,definit disappoint game ive play stori wise mercenari mode co op extrem fun hope well get futur
gqeclc7,Games,help know game base internet sensat call scp foundat hard describ basic websit describ creepi object event realli document big youtub worth googl help understand game
gqe7b1g,Games,finish crystal tower side quest tie last seri arr patch quest man owwi im still good time im glad im definit invest stori man damn quest im excit hop astrologian much like youv probabl heard peopl told thousand time stori goe rough get whole arr questlin feel potenti alreadi burn upsid cut hand quest even quest total overal im excit nonetheless im look forward stori advanc final explor world eorza
gqdmpsi,Games,start tank gnb man ffxiv communiti realli easi go new tank most find tank actual easier less stress dps peopl most match pace dictat
gqhsbgw,Games,your treat finish hw day blew away arr wasnt bad hw anoth level check option dungeon raid avail level well specif larg chain becom realli stori relev line shouldnt realli option imo buddi mine took dont get theyr option either theyr super cinemat well realli enjoy them
gqfs772,Games,wish game either fulli commit recruit thing didnt end feel like play less complic charact first matter pick gunkata takedown look way wors first one
gqh5cr3,Games,broke motiv game die mission end anoth charact side citi restart mission start begin dont mind lose charact even realli like dont want restart mn mission get expeci im lot less interest nd time
gqg41x4,Games,id avoid go summon cinder play thought id give playstyl tri liter facerol summon pet afkd corner kill liter everyth except wolnir theyr bug wont attack him
gq3ufed,Games,amateria roller coaster ride favourit game moment id play uru though continu stori uru v kind thing
gqc8naf,Games,good luck switch game got eye on
gqglfbd,Games,mean gone hidden longer avail would anyon that
gqfpuvl,Games,charact far pretti shallow uninterest charact write general biggest gripe game well much technic issu play launch got kid tv vibe like attempt spin younger audienc sure that realli go damn game fix anim fix bug cant fix write charact without rewrit game
gqis6jr,Games,conjunct plot set kill whole space pioneer thing wear lot thinner would expect justifi trade incred vibrant world well galaxi lol craft trilog didnt find new race lore compel all
gqgkvfi,Games,honest enjoy new crew quit lot find lot interest plot element either underutil primarili appear text entri etc lay groundwork probabl happen sequel divers main plotlin think lot peopl get hung want everyth proceed onward necessari general proceed fine pursu quest main interest someon get caught completionist step step mindset see would becom tedious inquisit issu ac odyssey new open world game way content necessari good bit realli great peopl love core gameplay loop want keep go lot content bad peopl want feel oblig hit everyth order move on
gqh0kaq,Games,combat dope super pretti world design decent charact hooooorribl stori think biggest problem weak lead male fem ryder
gqfs3gj,Games,think biggest issu game pointless openworld segment game built like first coupl think combat couldv carri more
gq6ujna,Games,honest amaz game high qualiti game kick keep think reason didnt better tezuka work doesnt realli seem big fanbas west despit incred term qualiti problem art seem say kiddish actual content wonder incred deep
gqh7dcr,Games,problem game didnt seem like stori go anywher got littl flash overarch stori begin hour hour dungeon run puzzl solv stori develop think drop like hour
gqed5zu,Games,zombi island fondest memori game rememb highway dlc lot run too
gq8v2fa,Games,k tv play cb k fps p tv right disregard comment amaz game tho
gqljsf1,Games,backlog realli consid purchas full price sure dumb would lol
gqebvxi,Games,brotherhood worth play love
gqdf444,Games,that pretti much experi new rpg assassin creed game theyr fine game time long best way play xp boost achiev someth like obvious bring question ubi soft intent implement hard level gate content
gqdcygu,Games,last longer found odyssey bore even finish desert stage
gq4ysg8,Games,check read lot good thing never explor romhack pokemon im surpris mani are
gq7a5mq,Games,yeah detect part game scan environ first person someth pop interest
gq7gqe6,Games,curious make think wow design make buy gold
gq8yjt8,Games,game alway come back slay spire matter mani week stop play heartbreak lose good run alway come back last ascend push manag get origin class realli proud incred addict game alway come back eventu even im stuck high ascens congratz reach realli get even difficult sts taught bang head wall long enough eventu wall break good luck
gqh0qs6,Games,im command shepard arknight favorit gacha citadel like arknight your gate much skill level pull main stori pretti much event clear team most oper dirt cheap max meanwhil even high develop meta oper youll get roll unless strateg correct meta unit easier use necessari ultra high endgam brag right stuff offer reward compar gacha genshin interest theyr differ approach hand max rariti rate arknight x higher vs piti shorter soft piti start pull get mani pull free pretti much everi pull someth usabl compar genshin garbag weapon https www youtub com watchv zmpcuo tudq arent even use fodder limit oper dont join main gacha pool happen x per year instead everi week hand genshin system banner charact pretti nice pull youv got base chanc featur charact miss roll next pull guarante featur charact piti carri banner give abil control rng extent guarante youll get charact want ive save guarante venti upcom rerun banner exampl meanwhil arknight ive got pull save surtr chanc pretti good could conceiv pull time banner get her
gqnpxr7,Games,memori none kingdom stuff realli requir progress beat game
gq8klyu,Games,speak rage baffl poor vehicl handl caus me
gqfthnr,Games,lot fun control realis gun useless use finish enemi get shot launch recharg use launch main weapon thing die pretti quick especi look big explos thing throw
gqjg62s,Games,believ there cheat mode menu still allow throphi upgrad gun feel god mode etc
gqh4t14,Games,first boss bit dumb yeah play like hide seek throw rock im sure section like iti bit place
gq7wo6d,Games,thought combat big highlight perfect meld action rpg turn base rpg thought realli uniqu fun play think other prais game know unanim click felt clunki okay too
gq793ni,Games,haha think pretti much feel game except problem tonal shift guess ive grown accustom japanes media like yakuza seri yeah solid think
gqfpyoa,Games,pay enough attent cant anyth substant play sound good podcast im alway look new podcast game
gqgllnh,Games,everhood video like fever dream definit go check out
gqmaghg,Games,youv sold everhood ill stick wishlist play soon
gqel8xe,Games,year away
gq9jcxl,Games,onlin game punish leav day ive never much multiplay guy rememb onlin game play give time drop rank left game
gqbxf3r,Games,tri luck r tipofmyjoystick guy insan find old unknown game
gqk78g8,Games,liero
gqf6elj,Games,sound like worm
gq4z6r4,Games,honest love last minut might product play game dlcs extra patch trilog realli special play back back felt like singl enorm hour epic liter cant think better cohes trilog asid probabl lotr
gq4wyc5,Games,yeah realli oversold decis make meld player choic pre defin charact wonder whether bethesda eventu tread area seem fallout protagonist step direct voic act backstori typic bethesda protagonist prepar next releas im sure want feel modern theyv open pandora box voic protagonist hard see go back interest see whether starfield take inspir biowar narrat framework regard shepard anoth exampl cdprs framework regard v geralt
gqoa146,Games,idk man watch normadi desper escap leav earth alway stuck well
gq5pypb,Games,ive heard long war kind brutal hard requir go engag realli would rather would punish well sort certain present opportun suicid mission usual retreat feel much game balanc risk vs reward take long term view someon hate lose troop reload frequent feel still get power curv lw want game hard fair start play unfair eg reload get pretti huge advantag alien point your abl regular crush your interest lw definit consid check doesnt brutal hard
gqc848g,Games,alt f zani bind isaac career suicid luck landlord million
gq8dkt3,Games,never read thank tip though
gq9htp3,Games,oh hope mess alreadi lol think though far realli go school kamoshida palac cafe ad ann team thank head up
gqc5o19,Games,dev pretti busi bunch new scroll weapon charact pick from
gq4qp8g,Games,theyr fantast game worth play dont think play nioh dont realli want gameplay standpoint nioh make first game feel kind redund doesnt make bunch sweep chang nioh nioh stuff better part tri play back back think itd pretti easi get burn plot game larg inconsequenti basic loos tell feudal era japanes histori supernatur twist most exist drive gameplay forward nioh callback nioh tie part stori nioh event specif dlc dont realli need know nioh plot understand major what happen nioh
gq52oi2,Games,care storylin id recommend find quick youtub summari first game sinc second game intersect stuff first know first game help moment feel less blue whether watch catch id say go straight nioh similar enough first gameplay mechan refin way inargu better experi pretti dang long game especi your get complet edit come extra dlc stuff keep busi long time
gqc49ra,Games,yeah combat fun especi like enemi
gqklfj9,Games,hes probabl slav languag sentenc make sens
gqd5mmo,Games,yes part realli good develop especi pretti sure big onlin storefront take steam soni microsoft mention probabl fund multipl game might never made otherwis first time glanc sideway partner pubg team optim unreal person battl royal mode fast forward month epic happen releas battl royal mode small fledgl game fortnit well optim fast forward month fortnit get famous steal specif danc made creator cultur around world give credit monetari thank taken court judg agre common sens basic theft intellectu properti start make pay creator epic kept continu practic ask permiss pay got caught cuz make money everi add lawsuit ever cost epic set industri expect live servic game rate ration develop hope match farm develop fortnit outsid studio world leader industri regard crunch burnout work cultur creat unreason consum expect know basic publish develop match especi anywher realm ethic someon manag match further consum expect game develop fast easi implement new idea turn make develop take time make good game seem like lazi incompet compani caus publish rush content incomplet game forc crunch anyth groundbreak shitti publish develop saw ball roll hop bought rocket put back might someon break industri quick rate hope would bring someth new help industri instead find hole dug shitti compani set mine rig locat excav realli find worst part
gqlrpwc,Games,haha ive play pretti much everi day sinc ive bought still problem end find bunch area secret bonus though occasion walk boss fight
gq3gkeq,Games,yeah like mario game pretti straightforward everyth land seem littl organ almost throwback certain feel plain comparison world world felt like tri way hard impress aesthet varieti instead mario game appreci sandbox mario game much end goal orient one lot stage gimmick taken land thought use better lot instanc like rhythm level platform flip jump thing like anoth problem strang isometri world never like view give level swap camera straight side view would sometim snap back odd moment like close border wall stage made distanc judgement bit rough time hard killer mario game pain toward later stage thing get bit busi found hit enemi thought go jump top zoom camera isometr angl made shadow difficult interpret land seem enjoy straight angl approach comfort top view save isometr angl most level rail platform far rememb much easier time judg distanc even slider could flow much athlet without take hit last think reli cat suit trivial platform game could fli stage climb everyth rotat charact hell think die use peach cat suit singl time almost cheat realli picki bowser car fight fun probabl picki wacki thing like feel home sandbox mario game cat bowser fight pretti cool though slight reminisc land final bowser favorit bowser seri like bowser still somewhat brutish threaten monster less comic nemesi
gq5f5wx,Games,option better get old alreadi proven mettl bit era anybodi realli care much git gud wherewith time repeat long portion game point game challeng better bespok option lack game over frequent checkpoint gngr would horrifi game offer option allow player set bar difficulti respect peopl could handl gruel quarter snatch arcad monstros without belt brace would peopl play game allow multipl difficulti set wish bloodstain cotm handl similar could walk mode part pretti intens time difficulti fuck walk enemi fall pit would appreci difficulti scale damag nix game over checkpoint still kinda bullshit bit infrequ final checkpoint long swath high damag high frequenc enemi boss arriv half dead matter least preserv knock back feel like core strategi play game nonexist anyway gngr frequent checkpoint well without game over lower difficulti least mean tackl piec stage though difficult puzzl experi without fear run live start level begin handl minut high frequenc respawn hellion without get hit twice
gq43dha,Games,lot time feel like boss fight creat way almost requir player exampl need deal boss minion feel overwhelm there thin herd protect back take figur effici divid attent
gq725j1,Games,today finish game first time start join player your right play co op make game lot harder harder anyth ive experienc solo
gq3g31s,Games,there definit stretch mani burn muddi fort got past last locat amaz visual hope trend continu throughout last chapter dlc kind like fight enemi kind like enjoy fight dmc doom learn move pwn style n increas enemi varieti help definit differ approach compar soul though
gq6im8y,Games,main issu nioh main mission long side mission minut main one often hour dont rememb nioh like think make tougher get becom gruel
gq41d17,Games,open world game think actual discourag explor game place version super overpow enemi certain area stori world reason simpli game doesnt want go mayb havent play enough rpgs time tw felt exact like imagin mmos feel engag stori overburden stat system grind
gqiewcn,Games,there chapter chapter super long
gq468o9,Games,yes awesom game play feel held pretti good first person horror physic manipul mechan done death sinc penumbra amnesia came love tone set penumbra lot amnesia
gq7i2uj,Games,find scene talk might start dlc met pythsgora father direct find artifact gain access atlanti
gq81fus,Games,yeah hush mega satan delirium ultra greedier requir there unlock give lost holi mantl start item pretti fair actual made lost pretti fun charact
gq87zyz,Games,thank much look game instant wishlist switch look awesom
gqkqsco,Games,youtub say that absolut fascin ive spent larg portion life onlin safe say ive never heard scp stuff definit given new mean game thank
gqeeyt1,Games,ill check out
gqeok5s,Games,need complet raid crystal tower advanc
gqj00t5,Games,crystal tower quest line
gqg70ir,Games,lol sound cool im make dumb build anyway tri everyth look interest btw far cinder best mani thing never knew need game love it
gq42dfx,Games,yeah found roller coaster magic great culmin level make sens first think ill main go releas order way seem logic thank advic
gqcsqvk,Games,play bowser furi tri decid want grind shine might move onto land though look bd octopath travel probabl pick though
gqiffds,Games,strike english translat foreign idiom could wrong guess would mean someth like radar
gqn6s8g,Games,meant stay hidden sorri
gqfunvu,Games,your right realli feel way appar your allow act like actual respect leader convers anymor way menac even evil
gqk0tbp,Games,yeah ive play hour sinc write comment im feel either pathfind sound pretti excit first ultim feel like excus make player trot unnecessarili big landscap hard anyth interest go on
gqojnr1,Games,thought gameplay ac odyssey much enjoy dont need spend much time travel inquisit andromeda odyssey never felt mmoy like inquisit andromeda me
gqphoid,Games,stori kick rough second main dungeon didnt like dungeon wouldnt recommend meat experi
gq8wgfy,Games,yeah tv is
gqlnmsh,Games,backlog there harm wait
gqdfl1e,Games,way better job describ experi game kind bummer got tri get aaa singl player game start ac tell use instant gratif competit multiplay game lot peopl seem agre ac feel stretch out
gqednpp,Games,im go tri defend ubisoft think think want next skyrim sens think want explor everi nook cranni game offer love problem everi game tri buy game year anymor everi aaa game tri inject much filler content possibl imposs play everyth time skyrim uniqu way captur imagin person lizardman catperson allow pretend play make believ world term ubisoft seem understand time doesnt understand meaning appreci ubisoft realli system approach game develop kind hinder yes love world differ reason need pick lane stick it
gqhr8ae,Games,like arknight your gate much skill level pull yeah look guid certain stage im stuck quit satisfi figur ofc still adapt guid strat accord oper still trial error most quit fun hahaha compar gacha genshin interest theyr differ approach honest compar genshin recent gacha game ive play ive play dragalia lost persona collab happen epic stuck longest dragalia generous free pull got featur charact dragon epic seven stingi either although iirc max rariti rate isnt high game similar arknight way low rariti unit still strong certain comp pull youv got base chanc featur charact miss roll next pull guarante featur charact sound nice actual still need pull first right consid bloat pull garbag weapon pull quit expens game id say genshin still worst gacha aspect gacha game ive play anyway im save surtr peopl r arknight subreddit hundr pull save still worri get meanwhil measli k orundum https gfycat com charmingidioticblobfish ralph wiggum quot homer simpson d
gqpw5lr,Games,fulli upgrad launch break game love it
gqhz6yr,Games,find pierc combin throw enough pretti much everi encount game pierc anyth cant easili throw fli guy rapid regener shield
gqmy9r7,Games,someon recent mention gun honest forgot game even spent vast vast major time hover around launch stuff enemi
gq8owp5,Games,think issu look like action game isnt whenev tri play like action game get frustrat dodg parri respons time super slow accept your middl anim your close your gonna get hit anyay abil miss anim super long target move drive nut definit click boss fight huge mob ive ignor parri complet im use circl quick run button treat game rpg go much better im less frustrat look like natur evolut lightn return combat wish ps ps capabl would final bring life old xiii combat system fake first trailer rather go action
gqhgrdg,Games,amaz podcast movi ive burn backlog movi play die certain pain sometim otherwis nice chill game wind with
gq9qhnl,Games,rank mode peopl even care decid end time game minut
gqc7us2,Games,that suggest name sfw subreddit lol
gqi5jot,Games,first thing thought well
gq521eo,Games,yeah actual didnt mind end choic uniqu felt overal made sens yeah perhap whole star child wasnt perfect explain threat face godlik larger life feel like that realli hard thing come airtight explan leviathan dlc shed light cours suck dlc regardless thought well done biggest gripe use cutscen liter chang colour end actual play game extend cut came opt play get vanilla experi see hate justifi realli wasnt wish peopl made fuss regard javik day dlc yeah whole fantast cohes epic experi havent play anyth els quit like it
gq9sbat,Games,even find til hour absolut fine definit miss opportun game heavili hint need want make sure miss look it
gqg6n97,Games,import thing know focus completel counselor confid get rank leav your safe
gqc6km8,Games,launch right post like minut ago saw new stuff pretti immedi stoke pour bunch hour week
gq766l6,Games,yeah weird like said anoth comment design boss make peopl help scale health damag output high worth it
gq3hmoz,Games,kind like fight enemi kind like enjoy fight dmc doom learn move pwn style that liter use say nioh lol complain nioh guess didnt expect dev use enemi nioh again
gq4qo8k,Games,yeah hurdl deal prefer combat system let take power enemi got skill case thing make realist like said enemi area general strength find open world game work real life clear stori driven game make sens peopl get invest read book
gq80zyh,Games,oh father spartan father make sens yes pretti far stori misunderstood father
gq8voum,Games,oh wow huge play vita got platinum vanilla pc like hour get holi mantl live way beat game lost actual fun way excit dive expans month see new stuff miss year
gq895ss,Games,hope enjoy it
gqkr1tf,Games,yeah dude pretti eeri massiv sea serpent never want read welcom happi share
gqettsc,Games,yeah coupl raid your abl finish last seri arr quest thank level smn sch queue healer theyr pretti fast overal thank
gqevjee,Games,case worri difficulti crystal tower raid month ago man raid old pretti much imposs fail even mess time yes worth awesom storylin massiv improv vanilla arr realli fun cool encount end play final fantasi afterward lol
gqjh7k1,Games,nah part primal quest uriang give quest youv advanc bit level
gqd8t92,Games,bd sound like good choic verit sea good choic frank switch strong librari youv got lot great time ahead thing
gqecp7o,Games,cop ask kind sir
gqhuq82,Games,genshin soft piti kick pull ramp fast think strategi make sens your piti check via histori button gacha page pull want otherwis save featur realli want havent stuck gacha outsid arknight genshin bounc granblu princess connect alchemist code anoth eden fgo experi success failur youv spent long term resourc make decis gameplay isnt interest me
gqngime,Games,mean still key part combat work togeth use power close drain switch gun charg mod even help charg laser gun honest realli fun use imo power absolut main draw sure
gq8w6qg,Games,yeah treat like full arpg like kingdom heart use command play well game realli shine use charact target weak stagger enemi quick switch charact action readi issu command hard hit attack felt realli good thing like feel like evolut xv combat look cool trailer play okay bit surfac level vii remak complex especi hard mode look forward see choos xvi
gqeolau,Games,think base porn sub basic idea porn
gqg6zag,Games,game hint lot thing doesnt tell consequ follow hint most consequ neglig except specif confid game give indic lock hour content dont complet
gqgwlts,Games,okay sure thank
gq6n168,Games,pc recommend mod remov arbitrari difficulti ad red skull enemi bitch fight actual doabl complet sort open world issu me
gqkrbsx,Games,game enough share link someth would great better way cap thursday night mental scar content serious though im surpris arent told start game give game whole differ feel
gqd8zig,Games,sorri brave default
gqefjv9,Games,went evga step process sorri bro answer your look for
gqfxn7e,Games,wouldnt refer express tip tongu
gqksr0s,Games,think dlc mention explicit call foundat beat anchor boss idk ill edit comment link sea serpent sec http www scpwiki com scp
gqdeuzw,Games,ohh gotcha thank clarifi ive never play first new look cool hell
gqey7zd,Games,wanna tell ton evga product lol
gqk8q09,Games,isnt funni peopl exposur common say probabl porn pun hear actual say
gqf0j98,Games,program evga purchas cpu gpu swap anoth cpu gpu month purchas regist product differ cost ship limit select gpus choos encompass popular product ftw ftw etc etc exampl purchas know step month purchas releas queu step month my
m3ehzi,Games,f f friday best day week final get home play video game weekend talk anyth game thread keep rule mind especi rule post set sort comment new default obligatori advertis r game discord server feel free join us chit chat game https discord gg zrpaxtn schedul discuss post week play https www reddit com r game searchq author aautomoder titl play restrict sr sort new monday themat monday https www reddit com r game searchq author aautomoder titl themat restrict sr sort new wednesday suggest game https www reddit com r game searchq author aautomoder titl suggest restrict sr sort new friday free talk friday https www reddit com r game searchq author aautomoder titl friday restrict sr sort new all
gqormi7,Games,moder chill bit new tag polici real eye sore even consist https imgur com vogi nq png way filter tag even use glare face dont want custom css hide tag use use like correct incorrect headlin dont want hide whenev appear right tag subreddit serv draw eye away actual headlin make brows experi wors
gqop4od,Games,late ive coupl match rude ask leav player wait friend sbmm incred rare encount peopl experienc decad rainbow vega left dead cod bocw gear co op got think age privat match pre made group friend list thing wait friend actual troll lie method legitim dont know thing start match
gqodtdl,Games,year stay away stori spoiler nier automata got spoil predict nevertheless fate charact steam review spiritfar peopl bunch bastard
gqoyne4,Games,im wait bloodborn drop pc probabl wont hollow knight silksong drop soon probabl wont crave non roguelit high action semi difficult great bossfight game right cant seem find anyth
gqohdc8,Games,assum lot gamer thing that mind exclus bethesda game xbox pc game pass devic ever big mean look elder scroll fallout exclus big rang game doom wolfenstein dishonor xbox solid set card hand think biggest wish come bethesda game next elder scroll return back style past great rpg mechan morrowind im optimist go get good inform year noth els ill say xbox king western rpgs
