id,subreddit,body
gqosyjk,Games,mean mtx allow ongo support game think rampant patch updat last generat caus peopl forget infrequ game support ps era game nowaday much longer shelf life compar generat prior general game maintain ongo revenu way drop eventu go mainten mode state non live game general get sporad patch first year general featur couldnt make launch like last year game get patch better ps xsx support work live servic titl compani stock drop bad releas lay staff long time make game volatil think larg part busi suck dlcs mtx allow compani overal breath room obvious could definit better implement
gqpwzrz,Games,peopl keep bring new asscre game got hour origin odyssey dont even know buy mtx either game realli theyr use odyssey got ton free updat includ entir quest season pass content easili worth money well
gqoy41z,Games,yeah never understood paid game pay oper overwatch doesnt oper part game make game free like lol valor never understood game becam famous like peopl spend much money peopl say enough grind buy oper like wtf pay game first place
gqptpn8,Games,longer get battlefield fuck grindfest game toler bf high school free time less money spend new game grind gear huge deal day massiv turnoff think gameplay affect element unlock start multiplay game halo reach overwatch right unlock cosmet
gqoz16s,Games,get everyth need sieg free without ever need spend purchas price cosmet elit uniform arent need get free oper new rework map free everi month
gqowfrm,Games,right like halo consid ton cosmet unlock back day amount would consid disappoint lack today standard fan mtx mean new map mode releas free therefor avoid fragment player base accept them
gqpfww5,Games,peopl dont rememb actual like forget mtx vast major game didnt cosmet all
gqpgbxk,Games,youd rather split communiti forc peopl pay content want play complaint huge blown proport possibl find healthi compromis allow friend play togeth without hurt avail content game solv lift restrict map player without dlc pack couldnt access dlc weapon skin etc parti werent broken multiplay match solut would restrict matchmak whatev map friend parti least dlc pack mean friend arent block play friend leav join solo queue go back play dlc paid bottom line shortag game healthi player popul back paid content basic option lot older classic paid dlc expans still activ communiti today give exampl cant think game back day unlock game nowaday battlefield v perfect exampl everyth took huge leap backward free content dump onto lap end less content qualiti content suffer result focus shift toward game cosmet ultim that earn money rocket scienc destini anoth perfect dumpster fire exampl new live model lacklust ultra grindi content destini wasnt perfect mean paid expans pack actual longer better qualiti content overal middl end lifecycl
gqp6lui,Games,lot peopl there lot enjoy charact customis fashion soul reason customis increas gate behind paywal lot peopl longer engag favourit part game
gqpapo1,Games,everyon els support model opt mean noth your subject inform discern mass support model lead wors evolut compani treat market poor get away with
gqpbe79,Games,person buy situat buy game
gqpun1x,Games,mani game distract play kill floor colleg roommat pretti fun game well group peopl play kill floor steam thought id join holi shit cant even tell what go game everi fuck thing cosmet bullshit upgrad game currenc real world currenc toler liter menu item cosmet bullshit care absolut noth game taken general pretti simpl fun game bloat mess ad noth cosmet store play leagu legend essenti feel way like way use bought stuff want f p dont mind monet unlock chest open key combin key fragment chest contain chard combin champion skin spend essenc get disench shard dont want etc etc etc find system bloat ridicul dont interact cant bother let play game loot game fun clear engag wouldnt it
gqpjbjs,Games,cool cosmet would never made mtx think dev would go way add ridicul rainbow laser camo gun werent abl sell look pre loot box cod standard textur old unlock diamond gold max rank gun
gqpqh2v,Games,argu easi play game fashion play fun buy dlc extend content time ever purchas cosmet upgrad genuin hit wrong button without think
gqpncjh,Games,normal armor absolut shit look pathet
gqpfc60,Games,whole game doe
gqp5kp0,Games,micro transact natur incentiv develop handicap earn thing game
gqou80p,Games,true game game abil past great reduc nonexist replac microtransact
gqpf95j,Games,play game pc instal wemod
gqpncff,Games,definit lot great titl past year even ignor there lot indi titl year still hold realli well
gqozrqe,Games,yeah your right feel cranki made post
gqp434o,Games,mayb mine absolut slap consist dole absolut banger cant appreci year time
gqpshe1,Games,think went peopl would go complain think price actual even micro transact would signific higher due ad cost beyond inflat think mani game cost match micro transact would loss sale price point increas might drive even higher think mani live servic game would need go subscript bring enough fund charg amount need front would caus huge sticker shock
gqpaohi,Games,forb littl glorifi blog site day compar
gqppqqh,Games,annoy fuck im good cant access game bought like destini eg choic use suboptim weapon armor order unlock item want game liter say go less fun otherwis would that decid lol
gqppjuu,Games,god yeah wildland somehow phenomen best flesh environ ubisoft game year still go back often stealth aspect custom tri surpass shot distanc amaz lol never even think need buy microtransact better experi first time ive ever express sentiment gr w anyon im glad im got speak
gqpdpai,Games,especi sinc buy exact amount v buck need monopoli money f p game scummi anticonsum tactic honest even sure legal peopl toler imagin walmart start sell walbuck weird currenc non transfer use walmart buy walbuck buy anyth walmart ridicul
gqow9zs,Games,right acknowledg post sieg skin like buy game much valu proposit ton modern game microtransact terribl huge problem
gqpq34y,Games,valu skin compar rest game ridicul skin realli valu cost player game hundr thousand
gqp62wt,Games,replac previous content avail full game paid unlock collect cheat fals content creat generat revenu revenu content isnt creat b affect gameplay make often way grindi mtx unlock timesav look better better potenti custom happen mobil game annual sport game nowher els ac origin constant overlevel even stori base side quest talk about
gqpjdwp,Games,dont think unless someth chang paid like ea sale bought pretti new https www rocketleagu com news chao run dlc pack today full price came car think bought full price bought pack sale idea like game f p would assum microtransact got price bump kind
gqpvjpi,Games,microtransact point
gqp7o2r,Games,wholli miss point fact would replac exact say player benefit microtransact model
gqpv6gk,Games,free compet free play game reason competit market microtransact think peopl play game free noth make money
gqpj5aw,Games,that us dont bother onlin game anymor
gqozrhw,Games,think reason like current mtx model much dont never care cosmet theyr go give free map mode go sell someon els costum cover cost alway seem like great deal me
gqp688r,Games,time develop roadmap alreadi place content pipelin regardless dont make money content get cancel theyr chariti
gqozfcx,Games,basic game list offer paid dlc simpli receiv regular updat all
gqp4bda,Games,sound like casino would take real piec shit run casino fail it
gqp96qo,Games,like afk arena whatev game ad someon play game look sad realiz play pay money theyr happi
gqpefbo,Games,celebr mediocr boy upstair want see much pay use get free tom petti last dj michael scott
gqplsyd,Games,health insur
gqpfygm,Games,that funni that manipul best valu thing everyon meant make oft choic clear better other player feel smart purchas smart choic realiti choic bad valu actual psychologist work shit disgust
gqpkin8,Games,ive releas mobil game purchas function make peopl take purchas serious like good stuff anyway big purchas price anchor make peopl feel posit thrifti support see posit feel loop custom arent screw purchas game peopl feel requir actual get predatori frustrat play store valu ad spend high googl ad compani mean everyth top chart realli fuck nasti pay win stuff afford big ad budget
gqpr1t1,Games,bargain compar charg now
gqpczmu,Games,delet
gqpe3yg,Games,least main game free experi content save mayb abyss f p game paid realli piss off
gqpglt1,Games,right wonder genshin impact would straight full price microtransact game feel like could game year would differ game alway tri steer toward buy someth least free game start still make gameplay mix decis purchas enjoy
gqpe20i,Games,never felt need go way grind anyth god war pick currenc chest play upgrad ran brock sindri stori progress wasnt realli endgam valkyri nifelheim etc game got grindi point alreadi spread fay ash
gqp5l2z,Games,topic anyon els actual prefer slower progress level race end game earli mid game content enjoy topic right microtransact becom problem affect game design rare see purchas signific affect gameplay tend steer clear game chang start consid dlcs small enough start feel like microtransact eu exampl start cast suspicion player argu dozen smaller dlcs push dev creat branch tree game design need ensur dlc branch break vanilla game trunk discourag network interconnect game mechan
gqpiesx,Games,next big gimmick season pass everi game season pass use forc peopl level see your miss pay time gate lock content
gqpqv2q,Games,differ game way way expens make ever compani find creativ way make money without seem like screw hope game popular enough sell plenti copi monster hunter world shine exampl right pay base game support hell ton base content even free dlc releas year half lead huge expans cost less base game along way option want realli dig ton micro dollar transact nitti gritti cosmet formula lead highest sell capcom game time
gqpdt9i,Games,extra asset pay simpli would exist without microtransact game content day ever microtransact
gqpgg0s,Games,id happili argu video game could seen even wors sinc unwant loot absolut resal valu
gqpicv2,Games,doesnt seem reason unless larg pack certain content realli think set cloth set gear worth full price game valu crazi peopl tri convinc worthwhil purchas bare anyth compar full game content itself
gqplnk8,Games,fuck thought hors armor might rememb fli mount wow someth sound posit decent modern standard
gqpqnh2,Games,game like skin unlock mayb per charact game never gave altern skin heck game give skin charact gun cloth accessori way option game still unlock heck game ton micro transact like rocket leagu give ton free stuff go play call duti modern warfar origin tell extra skin cosmet talki price far cent consum driven
gqpbyuf,Games,kid dont money get game play free season pass whale basic subsid f per
gqpbwr1,Games,f p season pass system realli forc peopl treat game like job daili login x amount daili week mission exclus cosmet content lock behind grind season pass adult job respons take care almost imposs keep want game let pay pace without forc login play everi day miss anyth
gqpf470,Games,dont understand system godsend kid adult depend tast think kid way way like want play game friend wherea find adult want thing play solo case person part there respons manag harder get togeth friend onlin even time organ tough kid liter dont option sinc cant buy stuff onlin either play f p game convinc parent buy game parent love f p game think would rather buy kid game theyr gonna play care would rather buy season pass f p game alreadi play time love
gqpeoet,Games,yeah probabl age runescap big rs classic call old school
gqpfiu4,Games,golden age f p game imo id take game like maplestori gunbound gunz duel etc day fortnit today love abl play game time feel fomo that becom preval ever sinc introduct battl pass love grindi game though felt like never ran content wherea im wait new season come might quit game start feel like chore need maxim playtim everi day daili
gqpea8e,Games,call softwar servic servic game make cargo ship full cash push there massiv trend game move model like almost everi singl genr servic mainstay im afraid go forward go see game landscap get thinner profit art enjoy drive forc behind product earth convinc game continuum spend time there
gqpfonu,Games,monster hunter equal topic toxic modern mtx tho mh give cosmet progress extra trinket emot home decor paid mtx okay price steep arguabl mhs custom lock behind mtx like modern game mention doubl fuck bethesda almost lock mod behind mtx argument support mod maker royalti put content remov lower age rate behind paywal simpl anim effect total war game trend goalpost thing cover first dev cycl season pass due higher decis debilit
gqpfb1s,Games,consid make skin work game year sure person higher standard id consid post launch support
gqprhqt,Games,believ think poe wouldnt near big communiti game instead f p
gqowckj,Games,mtx allow ongo support game meh plenti game manag support without peopl need stop defend fuck practic
gqpikg4,Games,oper grind post releas dlc expans one got game like near releas play enough get everi oper free releas start use renown cosmet caus fall behind oper around game earli third year quit play unrel reason sieg fair opinion least purchas full game cheap starter edit
gqp1ryn,Games,oper arent free without quit bit grind like hour grind singl new oper
gqoyaz4,Games,yeah peopl absolut cook there much unlock modern game insan there noth past arcad fps genr number unlock even close modern call duti exampl
gqpdz91,Games,probabl year worth subscript wow pure transmog system dumb feel type play dressup game game long time hurt game well armor set technic better like way look ill use isnt good look better imo wish sp game transmog
gqpequ9,Games,right like dont buy dont want shit paid game allow look like schmuck unless pay everybodi want look cool monet first place give cool look shit
gqpjeey,Games,cool cosmet would never made mtx time remov pitcher kool aid your chug
gqpqxxl,Games,problem notic game design warp around incentiv microtransact purchas brain did
gqoyvrk,Games,game abil past great reduc nonexist exampl
gqp05ql,Games,anyth like news outlet like npr pick type stori get front differ audienc even stuff peopl game known bit usual work done research check sourc overal better qualiti write
gqp6hwz,Games,sometim genius almost frighten
gqpa1cd,Games,disagre think post lame disclaim wont know post make sens year
gqpivt3,Games,https youtu derrj v xq
gqpkbfz,Games,reason prevent realli small purchas let somebodi buy someth profit get eaten credit card fee give somebodi purchas let combin lead worth stuff your still pay tini percentag total cost fee reason end enough buy want your incentiv buy point dont littl that sit account go wast anoth exampl thing make sens could appli fair price everyth increment minimum purchas wouldnt bad total corrupt peopl figur make scummi possibl like forc buy item cost
gqpad10,Games,develop mindset theyr better chase smaller number cosmet sale whale tri sell larger volum lower price without reason either whale buy lot larg care cost
gqp7ob8,Games,ac origin constant overlevel even stori base side quest talk person play everi ac ac aco timesav game sinc ac iirc collect map origin access npc shop becam microtransact like acr fals content creat generat revenu revenu content isnt creat alreadi mention exampl ac plenti older game use random cosmet even non lore joke one secret reward usual part base game
gqpj3nu,Games,control modern singl player game game unlock pre order exclus cosmet outfit main charact aspect game dont direct generat revenu contribut overal qualiti game theori drive sale unlock skin classic part game cut game sell later new addit creat generat revenu
gqpkdqo,Games,right car think mix goal explos mic drop right crazi imo
gqp6og1,Games,half sentenc sure doesnt work ignor half it
gqp21pe,Games,extrem true almost like appreci busi model dont anyth issu impli everi game everyon love inher need mtxs stay viabl releas content uh point game love true
gqp6oc8,Games,yes quot movi refer casino
gqp8rie,Games,friend use annual trip vega hed set asid gambl day weekend hed usual lose end trip point equival day food booz entertain sinc give refresh play look way isnt bad price
gqp6kvl,Games,fail again
gqpbk40,Games,yeah wonder could be
gqpo9fl,Games,heard achiev tremend feat elect presid
gqpexth,Games,that exact day arcad game busi import model home
gqpvr7z,Games,uhh casino busi challeng other free money doesnt mean wont fail plenti larg fix cost competit small fickl custom base maintain desir maintain payout rate get reddit rent free principl still full swing come fool proof everyon would it
gqpqjj1,Games,dont worri tho make money back run presid
gqpgz93,Games,yeah psycholog tactic use lot place dont slap best valu expens put second top expens option make second top seem better comparison
gqpx09u,Games,heck bought hors armor cent costum norm new costum purchas everi week coupl everi month soo put
gqphjha,Games,gear went wrong way would think aaa studio consol manufactur wouldnt need microtransact base game around gate multi player skin behind microtransact lootbx even skin campaign
gqpjlk5,Games,skip step never pay part itll hand month part full price indi never fackin that
gqpp088,Games,probabl wouldnt anywher near success sad moment game buy play get scrutin far harsh sinc prospect buyer feel oblig get money worth pretti iron go spend order magnitud wouldv will upfront freemium model rather good get foot door widest possibl user base hit sunk cost think leav plus much game gear toward engag gacha live servic model im doubt would even game all
gqp7vfh,Games,race end game earli mid game content enjoy game implement level boost purchas dont actual earli mid game content enjoy focus end game get stupid hoop jump through
gqpa9rf,Games,topic anyon els actual prefer slower progress level race end game earli mid game content enjoy actual enjoy slow progress lot problem progress turn mindless grind get level need proceed topic right microtransact becom problem affect game design rare see purchas signific affect gameplay tend steer clear game chang start consid dlcs small enough start feel like microtransact eu exampl start cast suspicion player argu dozen smaller dlcs push dev creat branch tree game design need ensur dlc branch break vanilla game trunk discourag network interconnect game mechan usual like paradox model agre huge problem cant make system interact much take account player remind stellari make ascens perk dlc featur let get perk improv empir base game thing dlcs ad uniqu empir type new possibl perk case game design affect sometim isnt easi tell subtl thing like level problem mention earlier lack featur inventori issu like one fallout store scrap repair gun etc encourag leav issu spot develop sell solut item avoid fine tun mechan get right peopl buy stuff mechan frustrat them
gqpehdy,Games,anyon els actual prefer slower progress level race end game earli mid game content enjoy depend dev go lock new content behind max level max stat hate slow level progress dev go creat content level play anyon level enjoy like wow darkmoon fair actual fun mayb kind quest level doesnt matter slower level fine realli dislik slow level sake slow level like your go adjust monster level level constant drop level entir theyr fake anyway
gqp8z23,Games,depend dont prefer slower progress level game take time ramp difficulti tend enjoy game trick think your progress show level tick damag number increas get bore theme park mmos like wow swtor way improv charact level get better gear lead rush highest level earli level gear worthless end anyway take anoth rpg like witcher level mechan combat deep enough allow progress understand system enemi lead becom invest stori world rather click quest pop up without read get game answer question progress level tend pretti arbitrari content engag player take time enjoy find easier engag progress isnt explicit tie charact level dont mind game use number help defin charact relat strength
gqp8wv1,Games,anyon els actual prefer slower progress level assum mani other includ prefer well pace progress regardless rate progress want unlock everyth game want unlock content last game game enough content progress captur thousand hour keep experi fresh excit problem play thousand hour unlock everyth long pace well convers hour game dole reward even hour
gqpiwm2,Games,simpli true look game like ssbm buttload content msx ton game past even e g thps load content mtx
gqpjwhs,Games,witcher mtx great game peopl couldnt get enough enough justifi hos b w expans sold use enough
gqpi0rj,Games,that argument bad deal consum ban argument latter over manipul say over advertis psycholog manipul random interv reinforc manipul gambl thing higher valu
gqpcz25,Games,season pass game great small gift kid bad chore get good grade
gqpo00y,Games,want game let pay pace without forc login play everi day miss anyth isnt key either dont buy premium season pass dont know game season pass doesnt free premium tier reward dont worri complet it
gqpifjl,Games,play ignor pass challeng never understood argument oh tier imposs grind season pass life zoomer ruin game play like live servic game current ever buy pass apex import thing improv skill enjoy gameplay mayb win cosmet cool arent main appeal game what wrong miss cosmet
gqpcuc2,Games,mean im adult full time job like battl pass there month im play game lot even weekend fun get addit unlock hard bad deal ive gotten hundr thousand hour game
gqpop9l,Games,hi adult minut per day log time ill buy game play bit pick pass dont wont hell even bought full season pass cod zombi last month see offer massiv discount end season snag enough coin season pass less pass anyway most look pass figur care usual dont case play game
gqpjf06,Games,great point get free hold valu kid still pretti nice friend even tho adult job
gqpw5oh,Games,disagre aw play game didnt pay
gqphbrr,Games,im sure articl discuss ac valhalla cosmet mtx system mh exact might give cosmet progress last still lock away anyth fact purchas set skip effort requir get even wors either way semant point exampl plop destini someth argument peopl like look cool everyon want look cool wasnt case wouldnt monet player brainwash believ cosmet mtx okay dont impact anyth everyon want look cool valhalla pay buck game forc look like pleb unless pay omega cool sick epic look armor disgust
gqpfqmh,Games,think game releas free updat charg cosmet system swbfii end end exampl full price game bunch free content post launch purchas cosmet that great system imo
gqpar24,Games,use phrase plenti game stop develop without it
gqoyr3q,Games,game form ongo revenu stream get frequent patch support sever year time stuff like man sky end anoth issu essenti lie state product sell shit ton copi lie use acquir revenu actual build game promis otherwis non live servic titl get near mani patch updat live servic titl includ stuff like communiti engag lie obvious never work compani gone due bad releas seen compani rapid chang game titl sell well project lot mtx stuff came compani tri develop financi secur riski titl alway sell even made decent game back day could still even break even still go lay larg amount staff certain better implement like peopl tri pay subscript various compani either live servic game like mmos suck consum somewhat allow compani stay power oppos put game wonder compani go surviv next week pray recoup develop cost opinion sub like understand tri give perspect someon develop side seen busi work intern
gqoy42q,Games,give exampl honest cant think support beyond first year patch without revenu stream im sure im sure plenti
gqpudag,Games,overwatch releas new hero avail immedi player frank find gameplay relat unlock competivi multiplay game straight unfair everi player access set tool
gqpr6lq,Games,complet wrong unless your talk starter edit scam hour sieg oper unlock per op would hour lot op bought full price start buy op order cheapest expens would enough renown spare unlock anoth op least addit dont need oper lot wholli interchang want maxim viabl rank competit liter everi tool need op came initi game releas plus kaid kali that liter that liter cheapest op even get get delux edit plus necessari altern critic base op thatcher bandit ban
gqp7qts,Games,even game chock full like tinesplitt doesnt hold candl amount stuff unlock pure gameplay cod mw dozen weapon dozen attach dozen differ camo trinket etc
gqpggrn,Games,peop often joke glamour true endgam year play ffxiv certain tell joke
gqpk3kl,Games,even read exampl
gqpdttg,Games,knew guy would buy loot box begin everi event overwatch play like crazi week buy anoth worth end everi month guy hes even big fish whale go never made sens id like dont play event see get buy box end your miss someth realli want respons alway get insan defens tell spend money want without explain make sens addict peopl man completion peopl real pretti sad
gqpc8jm,Games,collect map origin access npc shop becam microtransact like acr collect map still game without microtransact fwiw ac microtransact larg pay play game
gqp9je1,Games,kid like pay thing use free game la cart shit dont even know feel like discov new unlock costum get free dopamin spend allow pixel
gqp8vzc,Games,person play everi ac ac aco timesav game sinc ac iirc complet complet unnessiari time saver didnt give plan need make ship absolut best ship didnt need power win ship fight get resourc best part game thing black flag even slight push toward time saver assassin creed differ color cape microtransact altier outfit origin odyssey could get wacki awesom armor thing often even avail purchas yeah plenti cosmet still game free there even generat revenu
